kanji,id,keyword,components,on_reading,kun_reading,stroke_count,jlpt,romaji
寂,777,loneliness,house; uncle; above; small; little; crotch,ジャク; セキ,さび; さび.しい; さび.れる; さみ.しい,11,N1,jaku (ON); seki (ON); sabi (KUN); sabi.shii (KUN); sabi.reru (KUN); sami.shii (KUN)
淑,778,graceful,water; water droplets; water pistol; uncle; above; small; little; crotch,シュク,しと.やか,11,N1,shuku (ON); shito.yaka (KUN)
反,779,anti-,demonstation; cliff; crotch,ハン; ホン; タン; ホ,そ.る; そ.らす; かえ.す; かえ.る; -かえ.る,4,N3,han (ON); hon (ON); tan (ON); ho (ON); so.ru (KUN); so.rasu (KUN); kae.su (KUN); kae.ru (KUN); -kae.ru (KUN)
坂,780,slope,soil; dirt; ground; anti-; demonstration; cliff; crotch,ハン,さか,7,N2,han (ON); saka (KUN)
板,781,plank,tree; wood; anti-; demonstration; cliff; crotch,ハン; バン,いた,8,N2,han (ON); ban (ON); ita (KUN)
返,782,return,anti-; demonstration; cliff; crotch; road,ヘン,かえ.す; -かえ.す; かえ.る; -かえ.る,7,N3,hen (ON); kae.su (KUN); -kae.su (KUN); kae.ru (KUN); -kae.ru (KUN)
販,783,marketing,shellfish; clam; oyster; eye; animal legs; eight; anti-; demonstration; cliff; crotch,ハン,,11,N2,han (ON)
爪,784,claw,vulture,ソウ,つめ; つま-,4,,sou (ON); tsume (KUN); tsuma- (KUN)
妥,785,gentle,claw; vulture; woman,ダ,,7,N1,da (ON)
乳,786,milk,fledgling; claw; vulture; child; fishhook,ニュウ,ちち; ち,8,N2,nyuu (ON); chichi (KUN); chi (KUN)
浮,787,floating,water; water droplets; water pistol; fledgling; claw; vulture; child,フ,う.く; う.かれる; う.かぶ; む; う.かべる,10,N3,fu (ON); u.ku (KUN); u.kareru (KUN); u.kabu (KUN); mu (KUN); u.kaberu (KUN)
淫,788,lewd,water; water droplets; water pistol; claw; vulture; porter; drop; samurai,イン,ひた.す; ほしいまま; みだ.ら; みだ.れる; みだり,11,,in (ON); hita.su (KUN); hoshiimama (KUN); mida.ra (KUN); mida.reru (KUN); midari (KUN)
将,789,leader,turtle; claw; vulture; glue,ショウ; ソウ,まさ.に; はた; まさ; ひきい.る; もって,10,N2,shou (ON); sou (ON); masa.ni (KUN); hata (KUN); masa (KUN); hikii.ru (KUN); mote (KUN)
奨,790,exhort,leader; turtle; claw; vulture; glue; large; St. Bernard,ショウ; ソウ,すす.める,13,N1,shou (ON); sou (ON); susu.meru (KUN)
采,791,grab,claw; vulture; tree; wood,サイ,と.る; いろどり,8,N1,sai (ON); to.ru (KUN); irodori (KUN)
採,792,pick,finger; fingers; grab; claw; vulture; tree; wood,サイ,と.る,11,N2,sai (ON); to.ru (KUN)
菜,793,vegetable,flowers; grab; claw; vulture; tree; wood,サイ,な,11,N2,sai (ON); na (KUN)
受,794,accept,birdhouse; birdcage; claw; vulture; crown; crotch,ジュ,う.ける; -う.け; う.かる,8,N3,ju (ON); u.keru (KUN); -u.ke (KUN); u.karu (KUN)
授,795,impart,finger; fingers; accept; birdhouse; birdcage; claw; vulture; crown; crotch,ジュ,さず.ける; さず.かる,11,N1,ju (ON); sazu.keru (KUN); sazu.karu (KUN)
愛,796,love,birdhouse; birdcage; claw; vulture; crown; love birds; heart; walking legs,アイ,いと.しい,13,N3,ai (ON); ito.shii (KUN)
曖,797,unclear,sun; love; birdhouse; birdcage; claw; vulture; crown; love birds; heart; walking legs,アイ,くら.い,17,,ai (ON); kura.i (KUN)
払,798,pay,finger; fingers; elbow,フツ; ヒツ; ホツ,はら.う; -はら.い; -ばら.い,5,N3,futsu (ON); hitsu (ON); hotsu (ON); hara.u (KUN); -hara.i (KUN); -bara.i (KUN)
広,799,wide,cave; elbow,コウ,ひろ.い; ひろ.まる; ひろ.める; ひろ.がる; ひろ.げる,5,N4,kou (ON); hiro.i (KUN); hiro.maru (KUN); hiro.meru (KUN); hiro.garu (KUN); hiro.geru (KUN)
勾,800,hooked,bound up; elbow,コウ; ク,かぎ; ま.がる,4,,kou (ON); ku (ON); kagi (KUN); ma.garu (KUN)
拡,801,broaden,finger; fingers; wide; cave; elbow,カク; コウ,ひろ.がる; ひろ.げる; ひろ.める,8,N1,kaku (ON); kou (ON); hiro.garu (KUN); hiro.geru (KUN); hiro.meru (KUN)
鉱,802,mineral,metal; gold; wide; cave; elbow,コウ,あらがね,13,N2,kou (ON); aragane (KUN)
弁,803,valve,elbow; two hands,ベン; ヘン,わきま.える; わ.ける; はなびら; あらそ.う,5,N1,ben (ON); hen (ON); wakima.eru (KUN); wa.keru (KUN); hanabira (KUN); araso.u (KUN)
雄,804,male,Yamanote; by one’s side; elbow; turkey,ユウ,お-; おす; おん,12,N1,yuu (ON); o- (KUN); osu (KUN); on (KUN)
台,805,pedestal,elbow; mouth,ダイ; タイ,うてな; われ; つかさ,5,N4,dai (ON); tai (ON); utena (KUN); ware (KUN); tsukasa (KUN)
怠,806,neglect,pedestal; elbow; mouth; heart,タイ,おこた.る; なま.ける,9,N1,tai (ON); okota.ru (KUN); nama.keru (KUN)
治,807,reign,water; water droplets; water pistol; pedestal; elbow; mouth,ジ; チ,おさ.める; おさ.まる; なお.る; なお.す,8,N3,ji (ON); chi (ON); osa.meru (KUN); osa.maru (KUN); nao.ru (KUN); nao.su (KUN)
冶,808,metallurgy,ice; pedestal; elbow; mouth,ヤ,い.る,7,N1,ya (ON); i.ru (KUN)
始,809,commence,woman; pedestal; elbow; mouth,シ,はじ.める; -はじ.める; はじ.まる,8,N4,shi (ON); haji.meru (KUN); -haji.meru (KUN); haji.maru (KUN)
胎,810,womb,moon; month; flesh; part of the body; pedestal; elbow; mouth,タイ,,9,N1,tai (ON)
窓,811,window,hole; house; human legs; elbow; heart,ソウ; ス,まど; てんまど; けむだし,11,N3,sou (ON); su (ON); mado (KUN); tenmado (KUN); kemudashi (KUN)
去,812,gone,soil; dirt; ground; elbow,キョ; コ,さ.る; -さ.る,5,N4,kyo (ON); ko (ON); sa.ru (KUN); -sa.ru (KUN)
法,813,method,water; water droplets; water pistol; gone; soil; dirt; ground; elbow,ホウ; ハッ; ホッ; フラン,のり,8,N3,hou (ON); ha (ON); ho (ON); furan (ON); nori (KUN)
会,814,meeting,one; wall; umbrella; rising cloud; two; elbow; wall,カイ; エ,あ.う; あ.わせる; あつ.まる,6,N4,kai (ON); e (ON); a.u (KUN); a.waseru (KUN); atsu.maru (KUN)
至,815,climax,wall; one; ceiling; elbow; soil; dirt; ground,シ,いた.る,6,N1,shi (ON); ita.ru (KUN)
室,816,room,house; climax; wall; one; ceiling; elbow; soil; dirt; ground,シツ,むろ,9,N4,shitsu (ON); muro (KUN)
到,817,arrival,climax; wall; one; ceiling; elbow; soil; dirt; ground; sword; sabre; saber,トウ,いた.る,8,N3,tou (ON); ita.ru (KUN)
致,818,doth,climax; wall; one; ceiling; elbow; soil; dirt; ground; taskmaster,チ,いた.す,10,N1,chi (ON); ita.su (KUN)
互,819,mutually,one; ceiling; one; floor,ゴ,たが.い; かたみ.に,4,N3,go (ON); taga.i (KUN); katami.ni (KUN)
棄,820,abandon,infant; toddler; top hat; elbow; buckle; tree; wood,キ,す.てる,13,N1,ki (ON); su.teru (KUN)
育,821,bring up,infant; toddler; top hat; elbow; moon; month; flesh; part of the body,イク,そだ.つ; そだ.ち; そだ.てる; はぐく.む,8,N3,iku (ON); soda.tsu (KUN); soda.chi (KUN); soda.teru (KUN); haguku.mu (KUN)
撤,822,remove,finger; fingers; borstal; bring up; infant; toddler; top hat; elbow; moon; month; flesh; part of the body; taskmaster,テツ,,15,N1,tetsu (ON)
充,823,allot,infant; toddler; top hat; elbow; human legs,ジュウ,あ.てる; み.たす,6,N1,juu (ON); a.teru (KUN); mi.tasu (KUN)
銃,824,gun,metal; gold; allot; infant; toddler; top hat; elbow; human legs,ジュウ,つつ,14,N1,juu (ON); tsutsu (KUN)
硫,825,sulfur,sulphur; stone; rock; lifebelt; infant; toddler; top hat; elbow; stream; flood,リュウ,,12,N1,ryuu (ON)
流,826,current,water; water droplets; water pistol; lifebelt; infant; toddler; top hat; elbow; stream; flood,リュウ; ル,なが.れる; なが.れ; なが.す; -なが.す,10,N3,ryuu (ON); ru (ON); naga.reru (KUN); naga.re (KUN); naga.su (KUN); -naga.su (KUN)
允,827,license,elbow; human legs,イン,じょう; まこと.に; ゆるす,4,N1,in (ON); jou (KUN); makoto.ni (KUN); yurusu (KUN)
唆,828,tempt,mouth; streetwalker; Ministry of silly walks; John Cleese; license; elbow; human legs; walking legs,サ,そそのか.す,10,N1,sa (ON); sosonoka.su (KUN)
出,829,exit,,シュツ; スイ,で.る; -で; だ.す; -だ.す; い.でる; い.だす,5,N5,shutsu (ON); sui (ON); de.ru (KUN); -de (KUN); da.su (KUN); -da.su (KUN); i.deru (KUN); i.dasu (KUN)
山,830,mountain,,サン; セン,やま,3,N5,san (ON); sen (ON); yama (KUN)
拙,831,bungling,finger; fingers; exit,セツ,つたな.い,8,N1,setsu (ON); tsutana.i (KUN)
岩,832,boulder,mountain; stone; rock,ガン,いわ,8,N2,gan (ON); iwa (KUN)
炭,833,charcoal,mountain; ashes; cliff; fire,タン,すみ,9,N2,tan (ON); sumi (KUN)
岐,834,branch off,mountain; branch; ten; needle; crotch,キ; ギ,,7,N1,ki (ON); gi (ON)
峠,835,mountain pass,mountain; above; below,,とうげ,9,N1,touge (KUN)
崩,836,crumble,mountain; companion; moon; month; flesh; part of the body,ホウ,くず.れる; -くず.れ; くず.す,11,N1,hou (ON); kuzu.reru (KUN); -kuzu.re (KUN); kuzu.su (KUN)
密,837,secrecy,house; invariably; heart; mountain,ミツ,ひそ.か,11,N1,mitsu (ON); hiso.ka (KUN)
蜜,838,honey,house; invariably; heart; insect,ミツ; ビツ,,14,,mitsu (ON); bitsu (ON)
嵐,839,storm,mountain; wind; gnats; drop; insect,ラン,あらし,12,N1,ran (ON); arashi (KUN)
崎,840,promontory,mountain; strange; large; St. Bernard; can; street; nail; spike; mouth,キ,さき; さい; みさき,11,N1,ki (ON); saki (KUN); sai (KUN); misaki (KUN)
崖,841,bluffs,mountain; cliff; ivy; square jewel; soil; dirt; ground,ガイ; ゲ; ギ,がけ; きし; はて,11,,gai (ON); ge (ON); gi (ON); gake (KUN); kishi (KUN); hate (KUN)
入,842,enter,,ニュウ; ジュ,い.る; -い.る; -い.り; い.れる; -い.れ; はい.る,2,N5,nyuu (ON); ju (ON); i.ru (KUN); -i.ru (KUN); -i.ri (KUN); i.reru (KUN); -i.re (KUN); hai.ru (KUN)
込,843,crowded,enter; road,,こ.み; -こ.み; -こ.む; こ.む; こ.める,5,N3,ko.mi (KUN); -ko.mi (KUN); -ko.mu (KUN); ko.mu (KUN); ko.meru (KUN)
分,844,part,eight; sword; dagger,ブン; フン; ブ,わ.ける; わ.け; わ.かれる; わ.かる; わ.かつ,4,,bun (ON); fun (ON); bu (ON); wa.keru (KUN); wa.ke (KUN); wa.kareru (KUN); wa.karu (KUN); wa.katsu (KUN)
貧,845,poverty,part; eight; sword; dagger; shellfish; clam; oyster; eye; animal legs; eight,ヒン; ビン,まず.しい,11,N3,hin (ON); bin (ON); mazu.shii (KUN)
頒,846,partition,part; eight; sword; dagger; head; page; one; ceiling; drop; shellfish; clam; oyster; eye; animal legs; eight,ハン,わか.つ,13,N1,han (ON); waka.tsu (KUN)
公,847,public,eight; elbow,コウ; ク,おおやけ,4,N4,kou (ON); ku (ON); ooyake (KUN)
松,848,pine tree,tree; wood; public; eight; elbows,ショウ,まつ,8,N1,shou (ON); matsu (KUN)
翁,849,venerable old man,public; eight; elbows; feathers; wings,オウ,おきな,10,N1,ou (ON); okina (KUN)
訟,850,sue,say; words; keitai; mouth; public; eight; elbows,ショウ,,11,N1,shou (ON)
谷,851,valley,eight; umbrella; mouth,コク,たに; きわ.まる,7,N2,koku (ON); tani (KUN); kiwa.maru (KUN)
浴,852,bathe,water; water droplets; water pistol; valley; eight; umbrella; mouth,ヨク,あ.びる; あ.びせる,10,N2,yoku (ON); a.biru (KUN); a.biseru (KUN)
容,853,contain,house; valley; eight; umbrella; mouth,ヨウ,い.れる,10,N3,you (ON); i.reru (KUN)
溶,854,melt,water; water droplets; water pistol; contents; contain; house; valley; animal legs; eight; umbrella; mouth,ヨウ,と.ける; と.かす; と.く,13,N2,you (ON); to.keru (KUN); to.kasu (KUN); to.ku (KUN)
欲,855,longing,valley; eight; umbrella; mouth; lack; yawn,ヨク,ほっ.する; ほ.しい,11,N3,yoku (ON); ho.suru (KUN); ho.shii (KUN)
裕,856,abundant,cloak; valley; eight; umbrella; mouth,ユウ,,12,N1,yuu (ON)
鉛,857,lead (metal),lead; metal; gold; gully; eight; mouth,エン,なまり,13,N1,en (ON); namari (KUN)
沿,858,run alongside,water; water droplets; water pistol; gully; eight; mouth,エン,そ.う; -ぞ.い,8,N1,en (ON); so.u (KUN); -zo.i (KUN)
賞,859,prize,outhouse; small; little; crown; mouth; shellfish; clam; oyster; eye; animal legs; eight,ショウ,ほ.める,15,N2,shou (ON); ho.meru (KUN)
党,860,party,outhouse; small; little; crown; mouth; human legs,トウ,なかま; むら,10,N2,tou (ON); nakama (KUN); mura (KUN)
堂,861,hall,outhouse; small; little; crown; mouth; soil; dirt; ground,ドウ,,11,N4,dou (ON)
常,862,usual,outhouse; small; little; crown; mouth; towel,ジョウ,つね; とこ-,11,N3,jou (ON); tsune (KUN); toko- (KUN)
裳,863,skirt,outhouse; small; little; crown; mouth; cloth; clothes; clothing; garment,ショウ,も; もすそ,14,,shou (ON); mo (KUN); mosuso (KUN)
掌,864,manipulate,outhouse; small; little; crown; mouth; hand,ショウ,てのひら; たなごころ,12,N1,shou (ON); tenohira (KUN); tanagokoro (KUN)
皮,865,pelt,branch; ten; needle; crotch; hook,ヒ,かわ; けがわ,5,N2,hi (ON); kawa (KUN); kegawa (KUN)
波,866,waves,water; water droplets; water pistol; pelt; branch; ten; needle; crotch; hook,ハ,なみ,8,N2,ha (ON); nami (KUN)
婆,867,old woman,wave; water; water droplets; water pistol; pelt; branch; ten; needle; crotch; hook; woman,バ,ばば; ばあ,11,N1,ba (ON); baba (KUN); baa (KUN)
披,868,expose,finger; fingers; pelt; branch; ten; needle; crotch; hook,ヒ,,8,N1,hi (ON)
破,869,rend,stone; rock; pelt; branch; ten; needle; crotch; hook,ハ,やぶ.る; やぶ.れる,10,N3,ha (ON); yabu.ru (KUN); yabu.reru (KUN)
被,870,incur,cloak; pelt; branch; ten; needle; crotch; hook,ヒ,こうむ.る; おお.う; かぶ.る; かぶ.せる,10,N2,hi (ON); koumu.ru (KUN); oo.u (KUN); kabu.ru (KUN); kabu.seru (KUN)
残,871,remainder,bones; one; ceiling; evening; float,ザン; サン,のこ.る; のこ.す; そこな.う; のこ.り,10,N3,zan (ON); san (ON); noko.ru (KUN); noko.su (KUN); sokona.u (KUN); noko.ri (KUN)
殉,872,martyrdom,bones; one; ceiling; evening; decameron; bound up; sun; day,ジュン,,10,N1,jun (ON)
殊,873,particularly,bones; one; ceiling; evening; vermilion; drop; not yet; one; tree; wood,シュ,こと,10,N1,shu (ON); koto (KUN)
殖,874,augment,bones; one; ceiling; evening; straightaway; ten; needle; eye; fishhook,ショク,ふ.える; ふ.やす,12,N1,shoku (ON); fu.eru (KUN); fu.yasu (KUN)
列,875,file,bones; one; ceiling; evening; sword; sabre; saber,レツ; レ,,6,N3,retsu (ON); re (ON)
裂,876,split,file; bones; one; ceiling; evening; sword; sabre; saber; cloth; clothes; clothing; garment,レツ,さ.く; さ.ける; -ぎ.れ,12,N1,retsu (ON); sa.ku (KUN); sa.keru (KUN); -gi.re (KUN)
烈,877,ardent,file; bones; one; ceiling; evening; sword; sabre; saber; oven-fire; barbecue,レツ,はげ.しい,10,N1,retsu (ON); hage.shii (KUN)
死,878,death,bones; one; ceiling; evening; spoon; sitting on the ground,シ,し.ぬ; し.に-,6,N4,shi (ON); shi.nu (KUN); shi.ni- (KUN)
葬,879,interment,flowers; death; bones; one; ceiling; evening; spoon; sitting on the ground; two hands,ソウ,ほうむ.る,12,N1,sou (ON); houmu.ru (KUN)
瞬,880,wink,eye; Rose of Sharon; birdhouse; birdcage; claw; vulture; crown; sunglasses; dancing legs; ballerina; evening,シュン,またた.く; まじろ.ぐ,18,N1,shun (ON); matata.ku (KUN); majiro.gu (KUN)
耳,881,ear,,ジ,みみ,6,N3,ji (ON); mimi (KUN)
取,882,take,ear; crotch,シュ,と.る; と.り; と.り-; とり; -ど.り,8,N3,shu (ON); to.ru (KUN); to.ri (KUN); to.ri- (KUN); tori (KUN); -do.ri (KUN)
趣,883,gist,run; soil; dirt; ground; mend; take; ear; crotch,シュ,おもむき; おもむ.く,15,N1,shu (ON); omomuki (KUN); omomu.ku (KUN)
最,884,utmost,sun; day; take; ear; crotch,サイ; シュ,もっと.も; つま,12,N3,sai (ON); shu (ON); moto.mo (KUN); tsuma (KUN)
撮,885,snapshot,finger; fingers; utmost; sun; day; take; ear; crotch,サツ,と.る; つま.む; -ど.り,15,N1,satsu (ON); to.ru (KUN); tsuma.mu (KUN); -do.ri (KUN)
恥,886,shame,ear; heart,チ,は.じる; はじ; は.じらう; は.ずかしい,10,N3,chi (ON); ha.jiru (KUN); haji (KUN); ha.jirau (KUN); ha.zukashii (KUN)
職,887,post,ear; kazoo; sound; vase; stand up; sun; day; fiesta,ショク; ソク,,18,N3,shoku (ON); soku (ON)
聖,888,holy,ear; mouth; king; jewel; ball,セイ; ショウ,ひじり,13,N1,sei (ON); shou (ON); hijiri (KUN)
敢,889,daring,street; nail; spike; ear; taskmaster,カン,あ.えて; あ.えない; あ.えず,12,N1,kan (ON); a.ete (KUN); a.enai (KUN); a.ezu (KUN)
聴,890,listen,ear; stethoscope; camel; ten; needle; eye; cross-eyed; net; heart,チョウ; テイ,き.く; ゆる.す,17,N1,chou (ON); tei (ON); ki.ku (KUN); yuru.su (KUN)
懐,891,pocket,Freud; state of mind; poltergeist; BernaE; ten; needle; eye; cross-eyed; net; top hat; scarf; cloth; clothes; clothing; garment,カイ; エ,ふところ; なつ.かしい; なつ.かしむ; なつ.く; なつ.ける; なず.ける; いだ.く; おも.う,16,N1,kai (ON); e (ON); futokoro (KUN); natsu.kashii (KUN); natsu.kashimu (KUN); natsu.ku (KUN); natsu.keru (KUN); nazu.keru (KUN); ida.ku (KUN); omo.u (KUN)
慢,892,ridicule,Freud; state of mind; mandala; sun; day; eye; cross-eyed; net; crotch,マン,,14,N1,man (ON)
漫,893,loose,water; water droplets; water pistol; mandala; sun; day; eye; cross-eyed; net; crotch,マン,みがりに,14,N1,man (ON); migarini (KUN)
買,894,buy,eye; cross-eyed; net; shellfish; clam; oyster; eye; animal legs; eight,バイ,か.う,12,N4,bai (ON); ka.u (KUN)
置,895,placement,eye; cross-eyed; net; straightaway; ten; needle; eye; fishhook,チ,お.く; -お.き,13,N3,chi (ON); o.ku (KUN); -o.ki (KUN)
罰,896,penalty,eye; cross-eyed; net; say; words; keitai; mouth; sword; sabre; saber,バツ; バチ; ハツ,ばっ.する,14,N1,batsu (ON); bachi (ON); hatsu (ON); ba.suru (KUN)
寧,897,rather,house; heart; eye; cross-eyed; net; street; nail; spike,ネイ,むし.ろ,14,N1,nei (ON); mushi.ro (KUN)
濁,898,voiced,water; water droplets; water pistol; spider; eye; cross-eyed; net; bound up; insect,ダク; ジョク,にご.る; にご.す,16,N1,daku (ON); joku (ON); nigo.ru (KUN); nigo.su (KUN)
環,899,ring,king; jewel; ball; trampoline; eye; cross-eyed; net; one; ceiling; mouth; scarf,カン,わ,17,N1,kan (ON); wa (KUN)
還,900,send back,trampoline; eye; cross-eyed; net; one; ceiling; mouth; scarf; road,カン,かえ.る,16,N1,kan (ON); kae.ru (KUN)
夫,901,husband,one; large,フ; フウ; ブ,おっと; そ.れ,4,N3,fu (ON); fuu (ON); bu (ON); oto (KUN); so.re (KUN)
扶,902,aid,finger; fingers; husband,フ,たす.ける,7,N1,fu (ON); tasu.keru (KUN)
渓,903,mountain stream,water; water droplets; water pistol; claw; vulture; husband,ケイ,たに; たにがわ,11,N1,kei (ON); tani (KUN); tanigawa (KUN)
規,904,standard,husband; see; telescope; eye; human legs,キ,,11,N3,ki (ON)
替,905,exchange,husband; sun; day; tongue wagging,タイ,か.える; か.え-; か.わる,12,N2,tai (ON); ka.eru (KUN); ka.e- (KUN); ka.waru (KUN)
賛,906,approve,husband; shellfish; clam; oyster; eye; animal legs; eight,サン,たす.ける; たた.える,15,N3,san (ON); tasu.keru (KUN); tata.eru (KUN)
潜,907,submerge,water; water droplets; water pistol; exchange; husband; sun; day; tongue wagging,セン,ひそ.む; もぐ.る; かく.れる; くぐ.る; ひそ.める,15,N1,sen (ON); hiso.mu (KUN); mogu.ru (KUN); kaku.reru (KUN); kugu.ru (KUN); hiso.meru (KUN)
失,908,lose,drop; husband,シツ,うしな.う; う.せる,5,N3,shitsu (ON); ushina.u (KUN); u.seru (KUN)
鉄,909,iron,metal; gold; lose; drop; husband,テツ,くろがね,13,N2,tetsu (ON); kurogane (KUN)
迭,910,alternate,transfer; lose; drop; husband; road,テツ,,8,N1,tetsu (ON)
臣,911,retainer,slave,シン; ジン,,7,N2,shin (ON); jin (ON)
姫,912,princess,woman; retainer; slave,キ,ひめ; ひめ-,10,N1,ki (ON); hime (KUN); hime- (KUN)
蔵,913,storehouse,flowers; parade; retainer; slave,ゾウ; ソウ,くら; おさ.める; かく.れる,15,N2,zou (ON); sou (ON); kura (KUN); osa.meru (KUN); kaku.reru (KUN)
臓,914,entrails,moon; month; flesh; part of the body; storehouse; flowers; parade; retainer; slave,ゾウ,はらわた,19,N2,zou (ON); harawata (KUN)
賢,915,intelligent,loincloth; retainer; slave; crotch; shellfish; clam; oyster; eye; animal legs; eight,ケン,かしこ.い,16,N2,ken (ON); kashiko.i (KUN)
腎,916,kidney,loincloth; retainer; slave; crotch; moon; month; flesh; part of the body,ジン,,13,,jin (ON)
堅,917,strict,loincloth; retainer; slave; crotch; soil; dirt; ground,ケン,かた.い; -がた.い,12,N1,ken (ON); kata.i (KUN); -gata.i (KUN)
臨,918,look to,retainer; slave; reclining; lying down; goods; mouth,リン,のぞ.む,18,N1,rin (ON); nozo.mu (KUN)
覧,919,perusal,retainer; slave; reclining; lying down; one; floor; look; see; telescope; eye; human legs,ラン,み.る,17,N1,ran (ON); mi.ru (KUN)
巨,920,gigantic,Fafner,キョ,,5,N2,kyo (ON)
拒,921,repel,finger; fingers; gigantic; Fafner,キョ; ゴ,こば.む,8,N1,kyo (ON); go (ON); koba.mu (KUN)
力,922,power,muscle; arnold,リョク; リキ; リイ,ちから,2,N4,ryoku (ON); riki (ON); rii (ON); chikara (KUN)
男,923,man,rice field; brains; power; muscle; arnold,ダン; ナン,おとこ; お,7,N5,dan (ON); nan (ON); otoko (KUN); o (KUN)
労,924,labor,schoolhouse; owl; crown; power; muscle; arnold,ロウ,ろう.する; いたわ.る; いた.ずき; ねぎら; つか.れる; ねぎら.う,7,N3,rou (ON); rou.suru (KUN); itawa.ru (KUN); ita.zuki (KUN); negira (KUN); tsuka.reru (KUN); negira.u (KUN)
募,925,recruit,graveyard; flowers; sun; day; large; St. Bernard; power; muscle; arnold,ボ,つの.る,12,N2,bo (ON); tsuno.ru (KUN)
劣,926,inferiority,few; power; muscle; arnold,レツ,おと.る,6,N1,retsu (ON); oto.ru (KUN)
功,927,achievement,craft; powered; power; muscle; arnold,コウ; ク,いさお,5,N1,kou (ON); ku (ON); isao (KUN)
勧,928,persuade,pegasus; horse; pantomime horse; noon; sign of the horse; turkey; power; muscle; arnold,カン; ケン,すす.める,13,N1,kan (ON); ken (ON); susu.meru (KUN)
努,929,toil,guy; woman; crotch; power; muscle; arnold,ド,つと.める,7,N3,do (ON); tsuto.meru (KUN)
勃,930,uprising,bishop; cross; ten; needle; crown; child; power; muscle; arnold,ボツ; ホツ,おこ.る; にわかに,9,,botsu (ON); hotsu (ON); oko.ru (KUN); niwakani (KUN)
励,931,encourage,Wimbledon; cliff; ten thousand; power; muscle; arnold,レイ,はげ.む; はげ.ます,7,N1,rei (ON); hage.mu (KUN); hage.masu (KUN)
加,932,add,power; muscle; arnold; mouth,カ,くわ.える; くわ.わる,5,N3,ka (ON); kuwa.eru (KUN); kuwa.waru (KUN)
賀,933,congratulations,add; power; muscle; arnold; mouth; shellfish; clam; oyster; eye; animal legs; eight,ガ,,12,N1,ga (ON)
架,934,erect,add; power; muscle; arnold; mouth; tree; wood,カ,か.ける; か.かる,9,N1,ka (ON); ka.keru (KUN); ka.karu (KUN)
脇,935,armpit,moon; month; flesh; part of the body; triceps; power; muscle; arnold,キョウ,わき; わけ,10,,kyou (ON); waki (KUN); wake (KUN)
脅,936,threaten,triceps; power; muscle; arnold; moon; month; flesh; part of the body,キョウ,おびや.かす; おど.す; おど.かす,10,N1,kyou (ON); obiya.kasu (KUN); odo.su (KUN); odo.kasu (KUN)
協,937,co-,ten; needle; triceps; power; muscle; arnold,キョウ,,8,N2,kyou (ON)
行,938,going,boulevard,コウ; ギョウ; アン,い.く; ゆ.く; -ゆ.き; -ゆき; -い.き; -いき; おこな.う; おこ.なう,6,N5,kou (ON); gyou (ON); an (ON); i.ku (KUN); yu.ku (KUN); -yu.ki (KUN); -yuki (KUN); -i.ki (KUN); -iki (KUN); okona.u (KUN); oko.nau (KUN)
律,939,rhythm,Nelson; column; going; line; brush,リツ; リチ; レツ,,9,N2,ritsu (ON); richi (ON); retsu (ON)
復,940,restore,Nelson; column; going; line; fold back; double back; reclining; lying down; sun; day; walking legs,フク,また,12,N2,fuku (ON); mata (KUN)
得,941,gain,Nelson; column; going; line; bill posters; nightbreak; sun; day; one; floor; glue,トク,え.る; う.る,11,N3,toku (ON); e.ru (KUN); u.ru (KUN)
従,942,accompany,Nelson; column; going; line; horns; mend,ジュウ; ショウ; ジュ,したが.う; したが.える; より,10,N1,juu (ON); shou (ON); ju (ON); shitaga.u (KUN); shitaga.eru (KUN); yori (KUN)
徒,943,junior,Nelson; column; going; line; run; soil; dirt; ground; mend,ト,いたずら; あだ,10,N3,to (ON); itazura (KUN); ada (KUN)
待,944,wait,Nelson; column; going; line; Buddhist temple; soil; dirt; ground; glue,タイ,ま.つ; -ま.ち,9,N4,tai (ON); ma.tsu (KUN); -ma.chi (KUN)
往,945,journey,Nelson; column; going; line; candlestick; lord; drop; king; jewel; ball,オウ,い.く; いにしえ; さき.に; ゆ.く,8,N1,ou (ON); i.ku (KUN); inishie (KUN); saki.ni (KUN); yu.ku (KUN)
征,946,subjugate,Nelson; column; going; line; correct; one; ceiling; stop; footprint,セイ,,8,N1,sei (ON)
径,947,diameter,Nelson; column; going; line; spool; clod; toilet paper; crotch; soil; dirt; ground,ケイ,みち; こみち; さしわたし; ただちに,8,N1,kei (ON); michi (KUN); komichi (KUN); sashiwatashi (KUN); tadachini (KUN)
彼,948,he,Nelson; column; going; line; pelt; branch; ten; needle; crotch; hook,ヒ,かれ; かの; か.の,8,N3,hi (ON); kare (KUN); kano (KUN); ka.no (KUN)
役,949,duty,Nelson; column; going; line; cruise missile; missile; wind; crotch,ヤク; エキ,,7,N3,yaku (ON); eki (ON)
徳,950,benevolence,Nelson; column; going; line; stethoscope; camel; ten; needle; eye; cross-eyed; net; heart,トク,,14,N1,toku (ON)
徹,951,penetrate,Nelson; column; going; line; borstal; bring up; infant; toddler; top hat; elbow; moon; month; flesh; part of the body; taskmaster,テツ,,15,N1,tetsu (ON)
徴,952,indications,sherpa; Nelson; column; going; line; mountain; king; jewel; ball; taskmaster,チョウ; チ,しるし,14,N1,chou (ON); chi (ON); shirushi (KUN)
懲,953,penal,indications; sherpa; Nelson; column; going; line; mountain; king; jewel; ball; taskmaster; heart,チョウ,こ.りる; こ.らす; こ.らしめる,18,N1,chou (ON); ko.riru (KUN); ko.rasu (KUN); ko.rashimeru (KUN)
微,954,delicate,sherpa; Nelson; column; going; line; mountain; one; ceiling; human legs; taskmaster,ビ,かす.か,13,N1,bi (ON); kasu.ka (KUN)
街,955,boulevard,going; ivy; square jewel; soil; dirt; ground,ガイ; カイ,まち,12,N1,gai (ON); kai (ON); machi (KUN)
桁,956,girder,tree; wood; going,コウ,けた,10,,kou (ON); keta (KUN)
