kanji,id,keyword,components,on_reading,kun_reading,stroke_count,jlpt,romaji
渚,1353,strand,water; water droplets; water pistol; someone; puppet; sooty; old man; sun; day,ショ,なぎさ,11,N1,sho (ON); nagisa (KUN)
賭,1354,gamble,shellfish; clam; oyster; eye; animal legs; eight; someone; puppet; sooty; old man; sun; day,ト,か.ける; かけ,15,,to (ON); ka.keru (KUN); kake (KUN)
峡,1355,gorge,mountain; scissors; husband; horns,キョウ; コウ,はざま,9,N1,kyou (ON); kou (ON); hazama (KUN)
狭,1356,cramped,pack of wild dogs; scissors; husband; horns,キョウ; コウ,せま.い; せば.める; せば.まる; さ,9,N1,kyou (ON); kou (ON); sema.i (KUN); seba.meru (KUN); seba.maru (KUN); sa (KUN)
挟,1357,sandwiched,finger; fingers; scissors; husband; horns,キョウ; ショウ,はさ.む; はさ.まる; わきばさ.む; さしはさ.む,9,N2,kyou (ON); shou (ON); hasa.mu (KUN); hasa.maru (KUN); wakibasa.mu (KUN); sashihasa.mu (KUN)
頬,1358,cheek,,,,15,,
追,1359,chase,maestro; road,ツイ,お.う,9,N3,tsui (ON); o.u (KUN)
阜,1360,large hill,maestro; ten; needle,フ; フウ,,8,,fu (ON); fuu (ON)
師,1361,expert,maestro; noren; one; ceiling; towel,シ; ス,もろもろ; なら.う,10,N3,shi (ON); su (ON); moromoro (KUN); nara.u (KUN)
帥,1362,commander,maestro; towel,スイ,,9,N1,sui (ON)
官,1363,bureaucrat,house; maestro without baton,カン,,8,N3,kan (ON)
棺,1364,coffin,tree; wood; bureaucrat; house; maestro without baton,カン,,12,N1,kan (ON)
管,1365,pipe,bamboo; bureaucrat; house; maestro without baton,カン,くだ,14,N2,kan (ON); kuda (KUN)
父,1366,father,,フ,ちち,4,N5,fu (ON); chichi (KUN)
釜,1367,cauldron,father; metal; gold,フ,かま,10,,fu (ON); kama (KUN)
交,1368,mingle,top hat; father,コウ,まじ.わる; まじ.える; ま.じる; まじ.る; ま.ざる; ま.ぜる; -か.う; か.わす; かわ.す; こもごも,6,N3,kou (ON); maji.waru (KUN); maji.eru (KUN); ma.jiru (KUN); maji.ru (KUN); ma.zaru (KUN); ma.zeru (KUN); -ka.u (KUN); ka.wasu (KUN); kawa.su (KUN); komogomo (KUN)
効,1369,merit,mingle; top hat; father; power; muscle; arnold,コウ,き.く; ききめ; なら.う,8,N2,kou (ON); ki.ku (KUN); kikime (KUN); nara.u (KUN)
較,1370,contrast,car; mingle; top hat; father,カク; コウ,くら.べる,13,N1,kaku (ON); kou (ON); kura.beru (KUN)
校,1371,exam,tree; wood; mingle; top hat; father,コウ; キョウ,,10,N5,kou (ON); kyou (ON)
足,1372,leg,mouth; mending; mend,ソク,あし; た.りる; た.る; た.す,7,N4,soku (ON); ashi (KUN); ta.riru (KUN); ta.ru (KUN); ta.su (KUN)
促,1373,stimulate,person; leg; mouth; mending; mend,ソク,うなが.す,9,N1,soku (ON); unaga.su (KUN)
捉,1374,nab,finger; fingers; leg; mouth; mend,ソク; サク,とら.える,10,,soku (ON); saku (ON); tora.eru (KUN)
距,1375,long-distance,wooden leg; mouth; stop; footprint; giant,キョ,へだ.たる; けづめ,12,N1,kyo (ON); heda.taru (KUN); kezume (KUN)
路,1376,path,wooden leg; mouth; stop; footprint; each; walking legs; mouth,ロ; ル,-じ; みち,13,N3,ro (ON); ru (ON); -ji (KUN); michi (KUN)
露,1377,dew,rain; weather; path; wooden leg; mouth; stop; footprint; each; walking legs; mouth,ロ; ロウ,つゆ,21,N1,ro (ON); rou (ON); tsuyu (KUN)
跳,1378,hop,wooden leg; mouth; stop; footprint; portent; omen,チョウ,は.ねる; と.ぶ; -と.び,13,N1,chou (ON); ha.neru (KUN); to.bu (KUN); -to.bi (KUN)
躍,1379,leap,wooden leg; mouth; stop; footprint; futon; feathers; wings; turkey,ヤク,おど.る,21,N1,yaku (ON); odo.ru (KUN)
践,1380,tread,wooden leg; mouth; stop; footprint; parade float,セン,ふ.む,13,N1,sen (ON); fu.mu (KUN)
踏,1381,step,wooden leg; mouth; stop; footprint; wednesday; boots; water; sun; day,トウ,ふ.む; ふ.まえる,15,N1,tou (ON); fu.mu (KUN); fu.maeru (KUN)
踪,1382,trail,,ショウ; ソウ,あと,15,,shou (ON); sou (ON); ato (KUN)
骨,1383,skeleton,joint; moon; month; flesh; part of the body,コツ,ほね,10,N2,kotsu (ON); hone (KUN)
滑,1384,slippery,water; water droplets; water pistol; skeleton; joint; moon; month; flesh; part of the body,カツ; コツ,すべ.る; なめ.らか,13,N1,katsu (ON); kotsu (ON); sube.ru (KUN); name.raka (KUN)
髄,1385,marrow,skeleton; joint; moon; month; flesh; part of the body; highwayman; possess; by one’s side; road,ズイ,,19,N1,zui (ON)
禍,1386,calamity,altar; jawbone; joint; hood; mouth,カ,わざわい,13,N1,ka (ON); wazawai (KUN)
渦,1387,whirlpool,water; water droplets; water pistol; jawbone; joint; hood; mouth,カ,うず,12,N1,ka (ON); uzu (KUN)
鍋,1388,pot,metal; gold; jawbone; joint; hood; mouth,カ,なべ,17,,ka (ON); nabe (KUN)
過,1389,overdo,jawbone; joint; hood; mouth; road,カ,す.ぎる; -す.ぎる; -す.ぎ; す.ごす; あやま.つ; あやま.ち; よ.ぎる,12,N3,ka (ON); su.giru (KUN); -su.giru (KUN); -su.gi (KUN); su.gosu (KUN); ayama.tsu (KUN); ayama.chi (KUN); yo.giru (KUN)
阪,1390,Heights,heights; pinnacle; parthenon; acropolis; anti-; demonstration; cliff; crotch,ハン,さか,7,,han (ON); saka (KUN)
阿,1391,Africa,africa; pinnacle; parthenon; acropolis; can; mouth; street; nail; spike,ア; オ,おもね.る,8,N1,a (ON); o (ON); omone.ru (KUN)
際,1392,occasion,pinnacle; parthenon; acropolis; ritual; moon; month; flesh; part of the body; crotch; altar; show; two; small,サイ,きわ; -ぎわ,14,N3,sai (ON); kiwa (KUN); -giwa (KUN)
障,1393,hinder,pinnacle; parthenon; acropolis; badge; vase; stand up; sunflower; early; sun; day; ten; needle,ショウ,さわ.る,14,N1,shou (ON); sawa.ru (KUN)
隙,1394,chink,pinnacle; parthenon; acropolis; small; little; sun; day; little,ゲキ; キャク; ケキ,すき; す.く; す.かす; ひま,13,,geki (ON); kyaku (ON); keki (ON); suki (KUN); su.ku (KUN); su.kasu (KUN); hima (KUN)
随,1395,follow,pinnacle; parthenon; acropolis; highwayman; possess; by one’s side; moon; month; flesh; part of the body; road,ズイ,まにまに; したが.う,12,N1,zui (ON); manimani (KUN); shitaga.u (KUN)
陪,1396,auxiliary,obeisance; pinnacle; parthenon; acropolis; muzzle; vase; stand up; mouth,バイ,,11,N1,bai (ON)
陽,1397,sunshine,pinnacle; parthenon; acropolis; piggy bank; sun; day; piglets,ヨウ,ひ,12,N3,you (ON); hi (KUN)
陳,1398,line up,exhibit; pinnacle; parthenon; acropolis; east; tree; wood; sun; day,チン,ひ.ねる,11,N1,chin (ON); hi.neru (KUN)
防,1399,ward off,pinnacle; parthenon; acropolis; compass; direction,ボウ,ふせ.ぐ,7,N2,bou (ON); fuse.gu (KUN)
附,1400,affixed,pinnacle; parthenon; acropolis; adhere; sellotape; person; glue,フ,つ.ける; つ.く,8,N1,fu (ON); tsu.keru (KUN); tsu.ku (KUN)
院,1401,Inst.,pinnacle; parthenon; acropolis; perfect; house; beginnings; two; human legs,イン,,10,N4,in (ON)
陣,1402,camp,pinnacle; parthenon; acropolis; car,ジン,,10,N1,jin (ON)
隊,1403,regiment,pinnacle; parthenon; acropolis; animal horns; sow; pig; wart hog; regimental mascot,タイ,,12,N1,tai (ON)
墜,1404,crash,regiment; pinnacle; parthenon; acropolis; animal horns; sow; pig; wart hog; regimental mascot; soil; dirt; ground,ツイ,お.ちる; お.つ,15,N1,tsui (ON); o.chiru (KUN); o.tsu (KUN)
降,1405,descend,pinnacle; parthenon; acropolis; walking legs; sunglasses with one lens missing; monocle,コウ; ゴ,お.りる; お.ろす; ふ.る; ふ.り; くだ.る; くだ.す,10,N3,kou (ON); go (ON); o.riru (KUN); o.rosu (KUN); fu.ru (KUN); fu.ri (KUN); kuda.ru (KUN); kuda.su (KUN)
階,1406,story,storey; pinnacle; parthenon; acropolis; all; compare; spoon; sitting on the ground; white; dove,カイ,きざはし,12,N2,kai (ON); kizahashi (KUN)
陛,1407,highness,pinnacle; parthenon; acropolis; compare; spoon; sitting on the ground; soil; dirt; ground,ヘイ,,10,N1,hei (ON)
隣,1408,neighboring,neighbouring; pinnacle; parthenon; acropolis; shoeshine; rice; sunglasses; dancing legs; ballerina; evening,リン,とな.る; となり,16,N1,rin (ON); tona.ru (KUN); tonari (KUN)
隔,1409,isolate,pinnacle; parthenon; acropolis; tripod; one; ceiling; mouth; hood; human legs; street; nail; spike,カク,へだ.てる; へだ.たる,13,N1,kaku (ON); heda.teru (KUN); heda.taru (KUN)
隠,1410,conceal,pinnacle; parthenon; acropolis; hideaway; claw; vulture; broom; heart,イン; オン,かく.す; かく.し; かく.れる; かか.す; よ.る,14,N1,in (ON); on (ON); kaku.su (KUN); kaku.shi (KUN); kaku.reru (KUN); kaka.su (KUN); yo.ru (KUN)
堕,1411,degenerate,pinnacle; parthenon; acropolis; possess; by one’s side; moon; month; flesh; part of the body; ground; soil; dirt; ground,ダ,お.ちる; くず.す; くず.れる,12,N1,da (ON); o.chiru (KUN); kuzu.su (KUN); kuzu.reru (KUN)
陥,1412,collapse,pinnacle; parthenon; acropolis; straight-jacket; bound up; olden times; old days; stick; sun; day,カン,おちい.る; おとしい.れる,10,N1,kan (ON); ochii.ru (KUN); otoshii.reru (KUN)
穴,1413,hole,house; eight,ケツ,あな,5,N1,ketsu (ON); ana (KUN)
空,1414,empty,hole; house; human legs; craft,クウ,そら; あ.く; あ.き; あ.ける; から; す.く; す.かす; むな.しい,8,N4,kuu (ON); sora (KUN); a.ku (KUN); a.ki (KUN); a.keru (KUN); kara (KUN); su.ku (KUN); su.kasu (KUN); muna.shii (KUN)
控,1415,withdraw,finger; fingers; empty; sky; hole; house; human legs; craft,コウ,ひか.える; ひか.え,11,N1,kou (ON); hika.eru (KUN); hika.e (KUN)
突,1416,stab,hole; house; human legs; large; St. Bernard,トツ; カ,つ.く,8,N3,totsu (ON); ka (ON); tsu.ku (KUN)
究,1417,research,hole; house; human legs; nine; baseball,キュウ; ク,きわ.める,7,N4,kyuu (ON); ku (ON); kiwa.meru (KUN)
窒,1418,plug up,hole; house; human legs; climax; wall; one; ceiling; elbow; soil; dirt; ground,チツ,,11,N1,chitsu (ON)
窃,1419,stealth,hole; house; human legs; cut; seven; sword; dagger,セツ,ぬす.む; ひそ.か,9,N1,setsu (ON); nusu.mu (KUN); hiso.ka (KUN)
窟,1420,cavern,hole; house; human legs; yield; flag; exit,クツ; コツ,いわや; いはや; あな,13,,kutsu (ON); kotsu (ON); iwaya (KUN); ihaya (KUN); ana (KUN)
窪,1421,depression,hole; house; human legs; water; water droplets; water pistol; ivy; square jewel; soil; dirt; ground,ワ; ア,くぼ.む; くぼ.み; くぼ.まる; くぼ,14,,wa (ON); a (ON); kubo.mu (KUN); kubo.mi (KUN); kubo.maru (KUN); kubo (KUN)
搾,1422,squeeze,finger; fingers; tight; hole; house; human legs; saw,サク,しぼ.る,13,N1,saku (ON); shibo.ru (KUN)
窯,1423,kiln,hole; house; human legs; sheep; oven-fire; barbecue,ヨウ,かま,15,N1,you (ON); kama (KUN)
窮,1424,hard up,hole; house; human legs; somebody; nose; bow,キュウ; キョウ,きわ.める; きわ.まる; きわ.まり; きわ.み,15,N1,kyuu (ON); kyou (ON); kiwa.meru (KUN); kiwa.maru (KUN); kiwa.mari (KUN); kiwa.mi (KUN)
探,1425,grope,finger; fingers; paper punch; Miss World; hole; house; human legs; tree; wood,タン,さぐ.る; さが.す,11,N3,tan (ON); sagu.ru (KUN); saga.su (KUN)
深,1426,deep,water; water droplets; water pistol; paper punch; Miss World; hole; house; human legs; tree; wood,シン,ふか.い; -ぶか.い; ふか.まる; ふか.める; み-,11,N3,shin (ON); fuka.i (KUN); -buka.i (KUN); fuka.maru (KUN); fuka.meru (KUN); mi- (KUN)
丘,1427,hill,axe; one; floor,キュウ,おか,5,N1,kyuu (ON); oka (KUN)
岳,1428,Point,point; hill; axe; one; floor; mountain,ガク,たけ,8,N1,gaku (ON); take (KUN)
兵,1429,soldier,hill; axe; one; floor; animal legs; eight,ヘイ; ヒョウ,つわもの,7,N2,hei (ON); hyou (ON); tsuwamono (KUN)
浜,1430,seacoast,water; water droplets; water pistol; soldier; hill; axe; one; floor; animal legs; eight,ヒン,はま,10,N1,hin (ON); hama (KUN)
糸,1431,thread,spiderman,シ,いと,6,N2,shi (ON); ito (KUN)
織,1432,weave,thread; spiderman; kazoo; sound; vase; stand up; sun; day; fiesta,ショク; シキ,お.る; お.り; おり; -おり; -お.り,18,N1,shoku (ON); shiki (ON); o.ru (KUN); o.ri (KUN); ori (KUN); -ori (KUN); -o.ri (KUN)
繕,1433,darning,thread; spiderman; virtuous; sheep; horns; mouth,ゼン,つくろ.う,18,N1,zen (ON); tsukuro.u (KUN)
縮,1434,shrink,thread; spiderman; inn; house; person; hundred; one; ceiling; white; dove,シュク,ちぢ.む; ちぢ.まる; ちぢ.める; ちぢ.れる; ちぢ.らす,17,N1,shuku (ON); chiji.mu (KUN); chiji.maru (KUN); chiji.meru (KUN); chiji.reru (KUN); chiji.rasu (KUN)
繁,1435,luxuriant,cleverness; reclining; lying down; mother; breasts; taskmaster; thread; spiderman,ハン,しげ.る; しげ.く,16,N1,han (ON); shige.ru (KUN); shige.ku (KUN)
縦,1436,vertical,thread; spiderman; accompany; Nelson; column; going; line; horns; mend,ジュウ,たて,16,N1,juu (ON); tate (KUN)
緻,1437,fine,,チ,こまか.い,16,,chi (ON); komaka.i (KUN)
線,1438,line,thread; spiderman; spring; white; dove; water,セン,すじ,15,N2,sen (ON); suji (KUN)
綻,1439,come apart at the seams,thread; spiderman; determine; determined; house; mend,タン,ほころ.びる,14,,tan (ON); hokoro.biru (KUN)
締,1440,tighten,thread; spiderman; sovereign; vase; stand up; apron; crown; towel,テイ,し.まる; し.まり; し.める; -し.め; -じ.め,15,N1,tei (ON); shi.maru (KUN); shi.mari (KUN); shi.meru (KUN); -shi.me (KUN); -ji.me (KUN)
維,1441,fiber,thread; spiderman; turkey,イ,,14,N1,i (ON)
羅,1442,gauze,eye; cross-eyed; net; fibre; thread; spiderman; turkey,ラ,うすもの,19,N1,ra (ON); usumono (KUN)
練,1443,practice,thread; spiderman; east; tree; wood; sun; day,レン,ね.る; ね.り,14,N2,ren (ON); ne.ru (KUN); ne.ri (KUN)
緒,1444,thong,thread; spiderman; someone; puppet; sooty; old man; sun; day,ショ; チョ,お; いとぐち,14,N3,sho (ON); cho (ON); o (KUN); itoguchi (KUN)
続,1445,continue,thread; spiderman; sell; samurai; crown; human legs,ゾク; ショク; コウ; キョウ,つづ.く; つづ.ける; つぐ.ない,13,N3,zoku (ON); shoku (ON); kou (ON); kyou (ON); tsuzu.ku (KUN); tsuzu.keru (KUN); tsugu.nai (KUN)
絵,1446,picture,thread; spiderman; meeting; one; wall; umbrella; rising cloud; two; elbow; wall,カイ; エ,,12,N3,kai (ON); e (ON)
統,1447,overall,thread; spiderman; allot; infant; toddler; top hat; elbow; human legs,トウ,す.べる; ほび.る,12,N1,tou (ON); su.beru (KUN); hobi.ru (KUN)
絞,1448,strangle,thread; spiderman; mingle; top hat; father,コウ,しぼ.る; し.める; し.まる,12,N1,kou (ON); shibo.ru (KUN); shi.meru (KUN); shi.maru (KUN)
給,1449,salary,thread; spiderman; fit; meeting; umbrella; one; mouth,キュウ,たま.う; たも.う; -たま.え,12,N3,kyuu (ON); tama.u (KUN); tamo.u (KUN); -tama.e (KUN)
絡,1450,entwine,thread; spiderman; each; walking legs; mouth,ラク,から.む; から.まる,12,N2,raku (ON); kara.mu (KUN); kara.maru (KUN)
結,1451,tie,thread; spiderman; aerosol; samurai; mouth,ケツ; ケチ,むす.ぶ; ゆ.う; ゆ.わえる,12,N1,ketsu (ON); kechi (ON); musu.bu (KUN); yu.u (KUN); yu.waeru (KUN)
終,1452,end,thread; spiderman; winter; walking legs; ice; drop,シュウ,お.わる; -お.わる; おわ.る; お.える; つい; つい.に,11,N4,shuu (ON); o.waru (KUN); -o.waru (KUN); owa.ru (KUN); o.eru (KUN); tsui (KUN); tsui.ni (KUN)
級,1453,class,thread; spiderman; reach out; outstretched hands,キュウ,,9,N1,kyuu (ON)
紀,1454,chronicle,thread; spiderman; snake; self,キ,,9,N1,ki (ON)
紅,1455,crimson,thread; spiderman; craft,コウ; ク,べに; くれない; あか.い,9,N2,kou (ON); ku (ON); beni (KUN); kurenai (KUN); aka.i (KUN)
納,1456,settlement,thread; spiderman; inside; person; belt,ノウ; ナッ; ナ; ナン; トウ,おさ.める; -おさ.める; おさ.まる,10,N1,nou (ON); na (ON); na (ON); nan (ON); tou (ON); osa.meru (KUN); -osa.meru (KUN); osa.maru (KUN)
紡,1457,spinning,thread; spiderman; compass; direction,ボウ,つむ.ぐ,10,N1,bou (ON); tsumu.gu (KUN)
紛,1458,distract,thread; spiderman; part; eight; sword; dagger,フン,まぎ.れる; -まぎ.れ; まぎ.らす; まぎ.らわす; まぎ.らわしい,10,N1,fun (ON); magi.reru (KUN); -magi.re (KUN); magi.rasu (KUN); magi.rawasu (KUN); magi.rawashii (KUN)
紹,1459,introduce,thread; spiderman; summon; seduce; sword; dagger; mouth,ショウ,,11,N2,shou (ON)
経,1460,sutra,thread; spiderman; spool; clod; toilet paper; crotch; soil; dirt; ground,ケイ; キョウ,へ.る; た.つ; たていと; はか.る; のり,11,N3,kei (ON); kyou (ON); he.ru (KUN); ta.tsu (KUN); tateito (KUN); haka.ru (KUN); nori (KUN)
紳,1461,sire,thread; spiderman; monkey; sun; day; stick,シン,,11,N1,shin (ON)
約,1462,promise,thread; spiderman; ladle,ヤク,,9,N3,yaku (ON)
細,1463,dainty,thread; spiderman; rice field; brains,サイ,ほそ.い; ほそ.る; こま.か; こま.かい,11,N2,sai (ON); hoso.i (KUN); hoso.ru (KUN); koma.ka (KUN); koma.kai (KUN)
累,1464,accumulate,rice field; brains; thread; spiderman,ルイ,,11,N1,rui (ON)
索,1465,cord,bishop; cross; ten; needle; crown; thread; spiderman,サク,,10,N1,saku (ON)
総,1466,general,thread; spiderman; public; eight; elbows; heart,ソウ,す.べて; すべ.て; ふさ,14,N2,sou (ON); su.bete (KUN); sube.te (KUN); fusa (KUN)
綿,1467,cotton,thread; spiderman; napkin; white; dove; towel,メン,わた,14,N2,men (ON); wata (KUN)
絹,1468,silk,thread; spiderman; mouth; moon; month; flesh; part of the body,ケン,きぬ,13,N1,ken (ON); kinu (KUN)
繰,1469,winding,thread; spiderman; furniture; goods; mouth; tree; wood,ソウ,く.る,19,N1,sou (ON); ku.ru (KUN)
継,1470,inherit,thread; spiderman; rice; fishhook,ケイ,つ.ぐ; まま-,13,N1,kei (ON); tsu.gu (KUN); mama- (KUN)
緑,1471,green,thread; spiderman; dustpan; broom; grains of rice,リョク; ロク,みどり,14,N2,ryoku (ON); roku (ON); midori (KUN)
縁,1472,affinity,thread; spiderman; broom; sow; pig,エン; ネン,ふち; ふちど.る; ゆかり; よすが; へり; えにし,15,N1,en (ON); nen (ON); fuchi (KUN); fuchido.ru (KUN); yukari (KUN); yosuga (KUN); heri (KUN); enishi (KUN)
網,1473,netting,thread; spiderman; glass jar; hood; horns; one; deceased; perish; top hat; fishhook,モウ,あみ,14,N1,mou (ON); ami (KUN)
緊,1474,tense,loincloth; retainer; slave; crotch; thread; spiderman,キン,,15,N1,kin (ON)
紫,1475,purple,Prince; this here; stop; footprint; spoon; sitting on the ground; thread; spiderman,シ,むらさき,12,N1,shi (ON); murasaki (KUN)
縛,1476,truss,thread; spiderman; acupuncturist; specialty; drop; ten; needle; rice field; brains; glue,バク,しば.る,16,N1,baku (ON); shiba.ru (KUN)
縄,1477,straw rope,thread; spiderman; eels; sun; day,ジョウ,なわ; ただ.す,15,N1,jou (ON); nawa (KUN); tada.su (KUN)
幼,1478,infancy,cocoon; power; muscle; arnold,ヨウ,おさな.い,5,N2,you (ON); osana.i (KUN)
後,1479,behind,Nelson; column; going; line; cocoon; walking legs,ゴ; コウ,のち; うし.ろ; うしろ; あと; おく.れる,9,N5,go (ON); kou (ON); nochi (KUN); ushi.ro (KUN); ushiro (KUN); ato (KUN); oku.reru (KUN)
幽,1480,faint,seclude; cocoon; mountain,ユウ; ヨウ,ふか.い; かす.か; くら.い; しろ.い,9,N1,yuu (ON); you (ON); fuka.i (KUN); kasu.ka (KUN); kura.i (KUN); shiro.i (KUN)
幾,1481,how many,cocoon; person; fiesta,キ,いく-; いく.つ; いく.ら,12,N3,ki (ON); iku- (KUN); iku.tsu (KUN); iku.ra (KUN)
機,1482,mechanism,tree; wood; abacus; how many; cocoon; person; fiesta,キ,はた,16,N3,ki (ON); hata (KUN)
畿,1483,capital suburbs,cocoon; rice field; brains; fiesta,キ,みやこ,15,,ki (ON); miyako (KUN)
玄,1484,mysterious,top hat; cocoon,ゲン,,5,N1,gen (ON)
畜,1485,livestock,mysterious; top hat; cocoon; rice field; brains,チク,,10,N2,chiku (ON)
蓄,1486,amass,flowers; livestock; mysterious; top hat; cocoon; rice field; brains,チク,たくわ.える,13,N1,chiku (ON); takuwa.eru (KUN)
弦,1487,bowstring,bow; mysterious; top hat; cocoon,ゲン,つる,8,N1,gen (ON); tsuru (KUN)
擁,1488,hug,finger; fingers; mysterious; top hat; cocoon; turkey,ヨウ,,16,N1,you (ON)
滋,1489,nourishing,water; water droplets; water pistol; double-mysterious; mothballs; horns; one; cocoon,ジ,,12,N1,ji (ON)
慈,1490,mercy,double-mysterious; mothballs; horns; one; cocoon; heart,ジ,いつく.しむ,13,N1,ji (ON); itsuku.shimu (KUN)
磁,1491,magnet,stone; rock; double-mysterious; mothballs; horns; one; cocoon,ジ,,14,N1,ji (ON)
系,1492,lineage,stick; drop; thread; spiderman,ケイ,,7,N1,kei (ON)
係,1493,person in charge,person; lineage; drop; thread; spiderman,ケイ,かか.る; かかり; -がかり; かか.わる,9,N3,kei (ON); kaka.ru (KUN); kakari (KUN); -gakari (KUN); kaka.waru (KUN)
孫,1494,grandchild,child; lineage; drop; thread; spiderman,ソン,まご,10,N2,son (ON); mago (KUN)
懸,1495,suspend,prefecture; eye; fishhook; small; little; lineage; stick; drop; thread; spiderman; heart,ケン; ケ,か.ける; か.かる,20,N1,ken (ON); ke (ON); ka.keru (KUN); ka.karu (KUN)
遜,1496,modest,grandchild; child; lineage; drop; thread; spiderman; road,ソン,したが.う; へりくだ.る; ゆず.る,13,,son (ON); shitaga.u (KUN); herikuda.ru (KUN); yuzu.ru (KUN)
却,1497,instead,gone; soil; dirt; ground; elbow; stamp,キャク,かえ.って; しりぞ.く; しりぞ.ける,7,N1,kyaku (ON); kae.te (KUN); shirizo.ku (KUN); shirizo.keru (KUN)
脚,1498,shins,skids; moon; month; flesh; part of the body; instead; gone; soil; dirt; ground; elbow; stamp,キャク; キャ; カク,あし,11,N1,kyaku (ON); kya (ON); kaku (ON); ashi (KUN)
卸,1499,wholesale,horseshoe; horse; pantomime horse; noon; sign of the horse; stop; footprint; stamp,シャ,おろ.す; おろし; おろ.し,9,N1,sha (ON); oro.su (KUN); oroshi (KUN); oro.shi (KUN)
御,1500,honorable,Nelson; column; going; line; wholesale; horseshoe; pantomime horse; noon; sign of the horse; stop; footprint; stamp,ギョ; ゴ,おん-; お-; み-,12,N3,gyo (ON); go (ON); on- (KUN); o- (KUN); mi- (KUN)
服,1501,clothing,moon; month; flesh; part of the body; underpants; stamp; crotch,フク,,8,N4,fuku (ON)
命,1502,fate,fit; meeting; umbrella; one; mouth; stamp,メイ; ミョウ,いのち,8,N3,mei (ON); myou (ON); inochi (KUN)
令,1503,orders,meeting; chop-seal; hanko,レイ,,5,N2,rei (ON)
零,1504,zero,rain; weather; orders; meeting; chop-seal; hanko,レイ,ぜろ; こぼ.す; こぼ.れる,13,N2,rei (ON); zero (KUN); kobo.su (KUN); kobo.reru (KUN)
齢,1505,age,teeth; tooth; stop; footprint; rice; shovel; orders; meeting; chop-seal; hanko,レイ,よわ.い; とし,17,N2,rei (ON); yowa.i (KUN); toshi (KUN)
冷,1506,cool,ice; orders; meeting; chop-seal; hanko,レイ,つめ.たい; ひ.える; ひ.や; ひ.ややか; ひ.やす; ひ.やかす; さ.める; さ.ます,7,N3,rei (ON); tsume.tai (KUN); hi.eru (KUN); hi.ya (KUN); hi.yayaka (KUN); hi.yasu (KUN); hi.yakasu (KUN); sa.meru (KUN); sa.masu (KUN)
領,1507,jurisdiction,orders; meeting; chop-seal; hanko; head; page; one; ceiling; drop; shellfish; clam; oyster; eye; animal legs; eight,リョウ,えり,14,N2,ryou (ON); eri (KUN)
鈴,1508,small bell,metal; gold; orders; meeting; chop-seal; hanko,レイ; リン,すず,13,N1,rei (ON); rin (ON); suzu (KUN)
勇,1509,courage,chop-seal; hanko; male; rice field; brains; power; muscle; arnold,ユウ,いさ.む,9,N2,yuu (ON); isa.mu (KUN)
湧,1510,bubble up,water; water droplets; water pistol; courageous; courage; chop-seal; hanko; male; rice field; brains; power; muscle; arnold,ユウ; ヨウ; ユ,わ.く,12,N1,yuu (ON); you (ON); yu (ON); wa.ku (KUN)
通,1511,traffic,pogo stick; chop-seal; hanko; utilise; utilize; road,ツウ; ツ,とお.る; とお.り; -とお.り; -どお.り; とお.す; とお.し; -どお.し; かよ.う,10,N4,tsuu (ON); tsu (ON); too.ru (KUN); too.ri (KUN); -too.ri (KUN); -doo.ri (KUN); too.su (KUN); too.shi (KUN); -doo.shi (KUN); kayo.u (KUN)
踊,1512,jump,wooden leg; mouth; stop; footprint; pogo stick; chop-seal; hanko; utilise; utilize,ヨウ,おど.る,14,N2,you (ON); odo.ru (KUN)
疑,1513,doubt,spoon; sitting on the ground; dart; drop; heavens; chop-seal; hanko; zoo; critters,ギ,うたが.う,14,N3,gi (ON); utaga.u (KUN)
擬,1514,mimic,finger; fingers; doubt; spoon; sitting on the ground; dart; drop; heavens; chop-seal; hanko; zoo; critters,ギ,まが.い; もど.き,17,N1,gi (ON); maga.i (KUN); modo.ki (KUN)
凝,1515,congeal,ice; doubt; spoon; sitting on the ground; dart; drop; heavens; chop-seal; hanko; zoo; critters,ギョウ,こ.る; こ.らす; こご.らす; こご.らせる; こご.る,16,N1,gyou (ON); ko.ru (KUN); ko.rasu (KUN); kogo.rasu (KUN); kogo.raseru (KUN); kogo.ru (KUN)
範,1516,pattern,bamboo; car; fingerprint,ハン,,15,N1,han (ON)
犯,1517,crime,pack of wild dogs; fingerprint,ハン; ボン,おか.す,5,N3,han (ON); bon (ON); oka.su (KUN)
氾,1518,widespread,water; water droplets; water pistol; fingerprint,ハン,ひろ.がる,5,,han (ON); hiro.garu (KUN)
厄,1519,unlucky,cliff; fingerprint,ヤク,,4,N1,yaku (ON)
危,1520,dangerous,bound up; unlucky; cliff; fingerprint,キ,あぶ.ない; あや.うい; あや.ぶむ,6,N3,ki (ON); abu.nai (KUN); aya.ui (KUN); aya.bumu (KUN)
宛,1521,address,house; mailbox; evening; fingerprint,エン,あ.てる; -あて; -づつ; あたか.も,8,,en (ON); a.teru (KUN); -ate (KUN); -zutsu (KUN); ataka.mo (KUN)
腕,1522,arm,moon; month; flesh; part of the body; address; house; mailbox; evening; fingerprint,ワン,うで,12,N2,wan (ON); ude (KUN)
苑,1523,garden,flowers; mailbox; evening; fingerprint,エン; オン,その; う.つ,8,N1,en (ON); on (ON); sono (KUN); u.tsu (KUN)
怨,1524,grudge,mailbox; evening; fingerprint; heart,エン; オン; ウン,うら.む; うらみ; うら.めしい,9,,en (ON); on (ON); un (ON); ura.mu (KUN); urami (KUN); ura.meshii (KUN)
柳,1525,willow,tree; wood; blown eggs; sign of the hare; receipt; stamp,リュウ,やなぎ,9,N1,ryuu (ON); yanagi (KUN)
卵,1526,egg,sign of the hare; receipt; stamp; drops,ラン,たまご,7,N2,ran (ON); tamago (KUN)
留,1527,detain,receipt; sword; dagger; rice field; brains,リュウ; ル,と.める; と.まる; とど.める; とど.まる; るうぶる,10,N3,ryuu (ON); ru (ON); to.meru (KUN); to.maru (KUN); todo.meru (KUN); todo.maru (KUN); ruuburu (KUN)
