kanji,id,keyword,components,on_reading,kun_reading,stroke_count,jlpt,romaji
肥,1893,fertilizer,moon; month; flesh; part of the body; mosaic,ヒ,こ.える; こえ; こ.やす; こ.やし; ふと.る,8,N1,hi (ON); ko.eru (KUN); koe (KUN); ko.yasu (KUN); ko.yashi (KUN); futo.ru (KUN)
甘,1894,sweet,wicker basket; picnic basket,カン,あま.い; あま.える; あま.やかす; うま.い,5,N2,kan (ON); ama.i (KUN); ama.eru (KUN); ama.yakasu (KUN); uma.i (KUN)
紺,1895,navy blue,thread; spiderman; sweet; wicker basket; picnic basket,コン,,11,N1,kon (ON)
某,1896,so-and-so,sweet; wicker basket; picnic basket; tree; wood,ボウ,それがし; なにがし,9,N1,bou (ON); soregashi (KUN); nanigashi (KUN)
謀,1897,conspire,say; words; keitai; mouth; so-and-so; sweet; wicker basket; picnic basket; tree; wood,ボウ; ム,はか.る; たばか.る; はかりごと,16,N1,bou (ON); mu (ON); haka.ru (KUN); tabaka.ru (KUN); hakarigoto (KUN)
媒,1898,mediator,woman; so-and-so; sweet; wicker basket; picnic basket; tree; wood,バイ,なこうど,12,N1,bai (ON); nakoudo (KUN)
欺,1899,deceit,bushel basket; hamper; animal legs; eight; lack; yawn,ギ,あざむ.く,12,N1,gi (ON); azamu.ku (KUN)
棋,1900,chess piece,tree; wood; bushel basket; hamper; animal legs; eight,キ,ご,12,N1,ki (ON); go (KUN)
旗,1901,national flag,banner; compass; direction reclining; lying down; bushel basket; hamper; animal legs; eight,キ,はた,14,N1,ki (ON); hata (KUN)
期,1902,period,bushel basket; hamper; animal legs; eight; moon; month; flesh; part of the body,キ; ゴ,,12,N3,ki (ON); go (ON)
碁,1903,Go,go; bushel basket; hamper; animal legs; eight; stone; rock,ゴ,,13,N1,go (ON)
基,1904,fundamentals,bushel basket; hamper; animal legs; eight; soil; dirt; ground,キ,もと; もとい,11,N1,ki (ON); moto (KUN); motoi (KUN)
甚,1905,tremendously,bushel basket; hamper; equal; human legs,ジン,はなは.だ; はなは.だしい,9,N1,jin (ON); hanaha.da (KUN); hanaha.dashii (KUN)
勘,1906,intuition,tremendously; bushel basket; hamper; equal; human legs; power; muscle; arnold,カン,,11,N1,kan (ON)
堪,1907,withstand,soil; dirt; ground; tremendously; bushel basket; hamper; equal; human legs,カン; タン,た.える; たま.る; こ.らえる; こた.える,12,N1,kan (ON); tan (ON); ta.eru (KUN); tama.ru (KUN); ko.raeru (KUN); kota.eru (KUN)
貴,1908,precious,Takanohana; purse; in; one; floor; shellfish; clam; oyster; eye; animal legs; eight,キ,たっと.い; とうと.い; たっと.ぶ; とうと.ぶ,12,N1,ki (ON); tato.i (KUN); touto.i (KUN); tato.bu (KUN); touto.bu (KUN)
遺,1909,bequeath,precious; Takanohana; purse; in; one; floor; shellfish; clam; oyster; eye; animal legs; eight; road,イ; ユイ,のこ.す,15,N1,i (ON); yui (ON); noko.su (KUN)
遣,1910,dispatch,purse; in; one; floor; maestro without baton; road,ケン,つか.う; -つか.い; -づか.い; つか.わす; や.る,13,N1,ken (ON); tsuka.u (KUN); -tsuka.i (KUN); -zuka.i (KUN); tsuka.wasu (KUN); ya.ru (KUN)
潰,1911,defile,water; water droplets; water pistol; precious; Takanohana; purse; in; one; floor; shellfish; clam; oyster; eye; animal legs; eight,カイ; エ,つぶ.す; つぶ.れる; つい.える,15,,kai (ON); e (ON); tsubu.su (KUN); tsubu.reru (KUN); tsui.eru (KUN)
舞,1912,dance,reclining; lying down; tub; sunglasses; dancing legs; ballerina; evening,ブ,ま.う; -ま.う; まい,15,N3,bu (ON); ma.u (KUN); -ma.u (KUN); mai (KUN)
無,1913,nothingness,reclining; lying down; tub; oven-fire; barbecue,ム; ブ,な.い,12,,mu (ON); bu (ON); na.i (KUN)
組,1914,association,thread; spiderman; shelf; my bookshelves,ソ,く.む; くみ; -ぐみ,11,N3,so (ON); ku.mu (KUN); kumi (KUN); -gumi (KUN)
粗,1915,coarse,rice; shelf; my bookshelves,ソ,あら.い; あら-,11,N1,so (ON); ara.i (KUN); ara- (KUN)
租,1916,tariff,wheat; cereal; shelf; my bookshelves,ソ,,10,N1,so (ON)
狙,1917,aim at,pack of wild dogs; shelf; my bookshelves,ソ; ショ,ねら.う; ねら.い,8,,so (ON); sho (ON); nera.u (KUN); nera.i (KUN)
祖,1918,ancestor,altar; shelf; my bookshelves,ソ,,9,N3,so (ON)
阻,1919,thwart,pinnacle; parthenon; acropolis; shelf; my bookshelves,ソ,はば.む,8,N1,so (ON); haba.mu (KUN)
査,1920,investigate,tree; wood; shelf; my bookshelves,サ,,9,N2,sa (ON)
助,1921,help,shelf; my bookshelves; power; muscle; arnold,ジョ,たす.ける; たす.かる; す.ける; すけ,7,N3,jo (ON); tasu.keru (KUN); tasu.karu (KUN); su.keru (KUN); suke (KUN)
宜,1922,best regards,house; shelf; my bookshelves,ギ,よろ.しい; よろ.しく,8,N1,gi (ON); yoro.shii (KUN); yoro.shiku (KUN)
畳,1923,tatami mat,rice field; brains; crown; shelf; my bookshelves,ジョウ; チョウ,たた.む; たたみ; かさ.なる,12,N2,jou (ON); chou (ON); tata.mu (KUN); tatami (KUN); kasa.naru (KUN)
並,1924,row,,ヘイ; ホウ,な.み; なら.べる; なら.ぶ; なら.びに,8,N2,hei (ON); hou (ON); na.mi (KUN); nara.beru (KUN); nara.bu (KUN); nara.bini (KUN)
普,1925,universal,row; sun; day,フ,あまね.く; あまねし,12,N2,fu (ON); amane.ku (KUN); amaneshi (KUN)
譜,1926,musical score,say; words; keitai; mouth; universal; row; sun; day,フ,,19,N1,fu (ON)
湿,1927,damp,water; water droplets; water pistol; sun; day; row,シツ; シュウ,しめ.る; しめ.す; うるお.う; うるお.す,12,N2,shitsu (ON); shuu (ON); shime.ru (KUN); shime.su (KUN); uruo.u (KUN); uruo.su (KUN)
顕,1928,appear,sun; day; row; head; page; one; ceiling; drop; shellfish; clam; oyster; eye; animal legs; eight,ケン,あきらか; あらわ.れる,18,N1,ken (ON); akiraka (KUN); arawa.reru (KUN)
繊,1929,slender,thread; spiderman; Thanksgiving; harvest festival; ten; needle; fiesta; row,セン,,17,N1,sen (ON)
霊,1930,spirits,rain; weather; two; row,レイ; リョウ,たま,15,N1,rei (ON); ryou (ON); tama (KUN)
業,1931,profession,business; upside down in a row; not yet; tree; wood,ギョウ; ゴウ,わざ,13,N4,gyou (ON); gou (ON); waza (KUN)
撲,1932,slap,finger; fingers; upside down in a row; husband,ボク,,15,N1,boku (ON)
僕,1933,me,person; upside down in a row; husband,ボク,しもべ,14,N1,boku (ON); shimobe (KUN)
共,1934,together,salad; animal legs; eight,キョウ,とも; とも.に; -ども,6,N3,kyou (ON); tomo (KUN); tomo.ni (KUN); -domo (KUN)
供,1935,submit,person; strung together; salad; animal legs; eight,キョウ; ク; クウ; グ,そな.える; とも; -ども,8,N3,kyou (ON); ku (ON); kuu (ON); gu (ON); sona.eru (KUN); tomo (KUN); -domo (KUN)
異,1936,uncommon,rice field; brains; strung together; salad; animal legs; eight,イ,こと; こと.なる; け,11,N1,i (ON); koto (KUN); koto.naru (KUN); ke (KUN)
翼,1937,wing,feathers; wings; uncommon; rice field; brains; strung together; salad; animal legs; eight,ヨク,つばさ,17,N1,yoku (ON); tsubasa (KUN)
戴,1938,accept humbly,Thanksgiving; harvest festival; ten; needle; fiesta; uncommon; rice field; brains; strung together; salad; animal legs; eight,タイ,いただ.く,17,,tai (ON); itada.ku (KUN)
洪,1939,deluge,water; water droplets; water pistol; strung together; salad; animal legs; eight,コウ,,9,N1,kou (ON)
港,1940,harbor,deluge; water; water droplets; water pistol; scene; strung together; salad; animal legs; eight; snake; self,コウ,みなと,12,N3,kou (ON); minato (KUN)
暴,1941,outburst,sun; day; strung together; salad; animal legs; eight; grains of rice,ボウ; バク,あば.く; あば.れる,15,N2,bou (ON); baku (ON); aba.ku (KUN); aba.reru (KUN)
爆,1942,bomb,fire; outburst; strung together; salad; animal legs; eight; grains of rice,バク,は.ぜる,19,N2,baku (ON); ha.zeru (KUN)
恭,1943,respect,strung together; salad; animal legs; eight; valentine,キョウ,うやうや.しい,10,N1,kyou (ON); uyauya.shii (KUN)
選,1944,elect,southeast; snake; self; strung together; salad; animal legs; eight; road,セン,えら.ぶ,15,N3,sen (ON); era.bu (KUN)
殿,1945,Mr.,Mr; flag; strung together; salad; animal legs; eight; cruise missile; missile; wind; crotch,デン; テン,との; -どの,13,N2,den (ON); ten (ON); tono (KUN); -dono (KUN)
井,1946,well,,セイ; ショウ,い,4,N1,sei (ON); shou (ON); i (KUN)
丼,1947,donburi,well; drop,トン; タン; ショウ; セイ,どんぶり,5,,ton (ON); tan (ON); shou (ON); sei (ON); donburi (KUN)
囲,1948,surround,pent in; well,イ,かこ.む; かこ.う; かこ.い,7,N2,i (ON); kako.mu (KUN); kako.u (KUN); kako.i (KUN)
耕,1949,till,christmas tree; well,コウ,たがや.す,10,N2,kou (ON); tagaya.su (KUN)
亜,1950,Asia,roman two; mouth,ア; アシア,つ.ぐ,7,N1,a (ON); ashia (ON); tsu.gu (KUN)
悪,1951,bad,Asia; roman two; mouth; heart,アク; オ,わる.い; わる-; あ.し; にく.い; -にく.い; ああ; いずくに; いずくんぞ; にく.む,11,N4,aku (ON); o (ON); waru.i (KUN); waru- (KUN); a.shi (KUN); niku.i (KUN); -niku.i (KUN); aa (KUN); izukuni (KUN); izukunzo (KUN); niku.mu (KUN)
円,1952,circle,yen,エン,まる.い; まる; まど; まど.か; まろ.やか,4,N5,en (ON); maru.i (KUN); maru (KUN); mado (KUN); mado.ka (KUN); maro.yaka (KUN)
角,1953,angle,bound up; glass canopy; hood; walking cane; stick; two,カク,かど; つの,7,N2,kaku (ON); kado (KUN); tsuno (KUN)
触,1954,contact,angle; bound up; glass canopy; hood; walking cane; stick; two; insect,ショク,ふ.れる; さわ.る; さわ,13,N2,shoku (ON); fu.reru (KUN); sawa.ru (KUN); sawa (KUN)
解,1955,unravel,angle; bound up; glass canopy; hood; walking cane; stick; two; sword; dagger; cow,カイ; ゲ,と.く; と.かす; と.ける; ほど.く; ほど.ける; わか.る; さと.る,13,N3,kai (ON); ge (ON); to.ku (KUN); to.kasu (KUN); to.keru (KUN); hodo.ku (KUN); hodo.keru (KUN); waka.ru (KUN); sato.ru (KUN)
再,1956,again,king; jewel; ball; belt,サイ; サ,ふたた.び,6,N2,sai (ON); sa (ON); futata.bi (KUN)
講,1957,lecture,say; words; keitai; mouth; funnel; cone; celery; again,コウ,,17,N2,kou (ON)
購,1958,subscription,shellfish; clam; oyster; eye; animal legs; eight; funnel; cone; celery; again,コウ,,17,N1,kou (ON)
構,1959,posture,tree; wood; funnel; cone; celery; again,コウ,かま.える; かま.う,14,N3,kou (ON); kama.eru (KUN); kama.u (KUN)
溝,1960,gutter,water; water droplets; water pistol; funnel; cone; celery; again,コウ,みぞ,13,N1,kou (ON); mizo (KUN)
論,1961,argument,say; words; keitai; mouth; post-it note; meeting; scrapbook; glass canopy; hood; flowers,ロン,,15,N3,ron (ON)
倫,1962,ethics,person; post-it note; meeting; scrapbook; glass canopy; hood; flowers,リン,,10,N1,rin (ON)
輪,1963,wheel,car; post-it note; meeting; scrapbook; glass canopy; hood; flowers,リン,わ,15,N2,rin (ON); wa (KUN)
偏,1964,partial,person; fishfinger; door; one; ceiling; flag; scrapbook; glass canopy; hood; flowers,ヘン,かたよ.る,11,N1,hen (ON); katayo.ru (KUN)
遍,1965,everywhere,fishfinger; door; one; ceiling; flag; scrapbook; glass canopy; hood; flowers; road,ヘン,あまね.く,12,N1,hen (ON); amane.ku (KUN)
編,1966,compilation,thread; spiderman; fishfinger; door; one; ceiling; flag; scrapbook; glass canopy; hood; flowers,ヘン,あ.む; -あ.み,15,N2,hen (ON); a.mu (KUN); -a.mi (KUN)
冊,1967,tome,,サツ; サク,ふみ,5,N2,satsu (ON); saku (ON); fumi (KUN)
柵,1968,palisade,tree; wood; tome,サク; サン,しがら.む; しがらみ; とりで; やらい,9,,saku (ON); san (ON); shigara.mu (KUN); shigarami (KUN); toride (KUN); yarai (KUN)
典,1969,code,bend; tool,テン; デン,,8,N1,ten (ON); den (ON)
氏,1970,family name,drop; fishhook,シ,うじ; -うじ,4,N1,shi (ON); uji (KUN); -uji (KUN)
紙,1971,paper,thread; spiderman; family name,シ,かみ,10,N4,shi (ON); kami (KUN)
婚,1972,marriage,woman; dusk; family name; day,コン,,11,N3,kon (ON)
低,1973,lower,person; calling card; family name; one; floor,テイ,ひく.い; ひく.める; ひく.まる,7,N2,tei (ON); hiku.i (KUN); hiku.meru (KUN); hiku.maru (KUN)
抵,1974,resist,finger; fingers; calling card; family name; one; floor,テイ,,8,N1,tei (ON)
底,1975,bottom,cave; calling card; family name; one; floor,テイ,そこ,8,N2,tei (ON); soko (KUN)
民,1976,people,mouth; family name,ミン,たみ,5,N3,min (ON); tami (KUN)
眠,1977,sleep,eye; people; mouth; family name,ミン,ねむ.る; ねむ.い,10,N3,min (ON); nemu.ru (KUN); nemu.i (KUN)
捕,1978,catch,finger; fingers; dog-tag; arrowhead; screwdriver; utilize; utilise,ホ,と.らえる; と.らわれる; と.る; とら.える; とら.われる; つか.まえる; つか.まる,10,N3,ho (ON); to.raeru (KUN); to.rawareru (KUN); to.ru (KUN); tora.eru (KUN); tora.wareru (KUN); tsuka.maeru (KUN); tsuka.maru (KUN)
哺,1979,suckle,,ホ,はぐく.む; ふく.む,10,,ho (ON); haguku.mu (KUN); fuku.mu (KUN)
浦,1980,bay,water; water droplets; water pistol; dog-tag; arrowhead; screwdriver; utilize; utilise,ホ,うら,10,N1,ho (ON); ura (KUN)
蒲,1981,bullrush,bulrush; flowers; bay; water; water droplets; water pistol; dog-tag; arrowhead; screwdriver; utilize; utilise,ホ; ボ; フ; ブ,がま; かば; かま,13,,ho (ON); bo (ON); fu (ON); bu (ON); gama (KUN); kaba (KUN); kama (KUN)
舗,1982,shop,cottage; little-thatch; umbrella; earthenware jar; lidded crock; soil; dirt; ground; mouth; dog-tag; arrowhead; screwdriver; utilize; utilise,ホ,,15,N1,ho (ON)
補,1983,supplement,cloak; dog-tag; arrowhead; screwdriver; utilize; utilise,ホ,おぎな.う,12,N2,ho (ON); ogina.u (KUN)
邸,1984,residence,calling card; family name; one; floor; city walls,テイ,やしき,8,N1,tei (ON); yashiki (KUN)
郭,1985,enclosure,receive; tall; top hat; mouth; child; children; city walls,カク,くるわ,11,N1,kaku (ON); kuruwa (KUN)
郡,1986,county,old boy; mop; mouth; city walls,グン,こうり,10,N1,gun (ON); kouri (KUN)
郊,1987,outskirts,mingle; top hat; father; city walls,コウ,,9,N2,kou (ON)
部,1988,section,muzzle; vase; stand up; mouth; city walls,ブ,-べ,11,N3,bu (ON); -be (KUN)
都,1989,metropolis,someone; puppet; sooty; old man; sun; day; city walls,ト; ツ,みやこ,11,N3,to (ON); tsu (ON); miyako (KUN)
郵,1990,mail,droop; silage; city walls,ユウ,,11,N2,yuu (ON)
邦,1991,home country,bushes; city walls,ホウ,くに,7,N1,hou (ON); kuni (KUN)
那,1992,interrogative,sword; dagger; two; city walls,ナ; ダ,なに; なんぞ; いかん,7,N1,na (ON); da (ON); nani (KUN); nanzo (KUN); ikan (KUN)
郷,1993,hometown,home town; cocoon; silver; city walls,キョウ; ゴウ,さと,11,N1,kyou (ON); gou (ON); sato (KUN)
響,1994,echo,home town; cocoon; silver; city walls; sound; vase; stand up; sun; day; tongue wagging,キョウ,ひび.く,20,N1,kyou (ON); hibi.ku (KUN)
郎,1995,son,halo; good; drop; silver; city walls,ロウ; リョウ,おとこ,9,N1,rou (ON); ryou (ON); otoko (KUN)
廊,1996,corridor,cave; son; halo; good; drop; silver; city walls,ロウ,,12,N1,rou (ON)
盾,1997,shield,drag; ten; needle; eye,ジュン,たて,9,N1,jun (ON); tate (KUN)
循,1998,sequential,Nelson; column; going; line; shield; drag; ten; needle; eye,ジュン,,12,N1,jun (ON)
派,1999,faction,water; water droplets; water pistol; caveman; drag; person; rag,ハ,,9,N1,ha (ON)
脈,2000,vein,moon; month; flesh; part of the body; caveman; drag; person; rag,ミャク,すじ,10,N1,myaku (ON); suji (KUN)
衆,2001,masses,blood; drop; dish; Carol in rags person; rag,シュウ; シュ,おお.い,12,N1,shuu (ON); shu (ON); oo.i (KUN)
逓,2002,parcel post,drag; cornstalk; belt; road,テイ,かわ.る; たがいに,10,N1,tei (ON); kawa.ru (KUN); tagaini (KUN)
段,2003,grade,staple gun; cruise missile; missile; wind; crotch,ダン; タン,,9,N3,dan (ON); tan (ON)
鍛,2004,forge,metal; gold; grade; staple gun; cruise missile; missile; wind; crotch,タン,きた.える,17,N1,tan (ON); kita.eru (KUN)
后,2005,empress,drag; one; ceiling; mouth,コウ; ゴ,きさき,6,N1,kou (ON); go (ON); kisaki (KUN)
幻,2006,phantasm,cocoon; clothes hanger; coat hanger,ゲン,まぼろし,4,N1,gen (ON); maboroshi (KUN)
司,2007,director,clothes hanger; coat hanger; one; mouth,シ,つかさど.る,5,N1,shi (ON); tsukasado.ru (KUN)
伺,2008,pay respects,person; director; Ken Russel; clothes hanger; coat hanger; one; mouth,シ,うかが.う,7,N2,shi (ON); ukaga.u (KUN)
詞,2009,parts of speech,part of speech; say; words; keitai; mouth; director; Ken Russel; clothes hanger; coat hanger; one; mouth,シ,,12,N2,shi (ON)
飼,2010,domesticate,eat; food; umbrella; good; halo; drop; silver; director; Ken Russel; clothes hanger; coat hanger; one; mouth,シ,か.う,13,N1,shi (ON); ka.u (KUN)
嗣,2011,heir,mouth; scrapbook; glass canopy; hood; flowers; director; Ken Russel; clothes hanger; coat hanger; one; mouth,シ,,13,N1,shi (ON)
舟,2012,boat,,シュウ,ふね; ふな-; -ぶね,6,N2,shuu (ON); fune (KUN); funa- (KUN); -bune (KUN)
舶,2013,liner,boat; white; dove,ハク,,11,N1,haku (ON)
航,2014,navigate,boat; whirlwind; top hat; wind,コウ,,10,N2,kou (ON)
舷,2015,gunwale,boat; mysterious; top hat; cocoon,ゲン,ふなべい; ふなばた,11,,gen (ON); funabei (KUN); funabata (KUN)
般,2016,carrier,boat; cruise missile; missile; wind; crotch,ハン,,10,N2,han (ON)
盤,2017,tray,carrier; boat; cruise missile; missile; wind; crotch; dish,バン,,15,N1,ban (ON)
搬,2018,conveyor,finger; fingers; carrier; boat; cruise missile; missile; wind; crotch,ハン,,13,N1,han (ON)
船,2019,ship,boat; gully; eight; mouth,セン,ふね; ふな-,11,N3,sen (ON); fune (KUN); funa- (KUN)
艦,2020,warship,boat; oversee; retainer; slave; reclining; lying down; one; floor; dish,カン,,21,N1,kan (ON)
艇,2021,rowboat,boat; courts; porter; drop; samurai; stretch,テイ,,13,N1,tei (ON)
瓜,2022,melon,claw; vulture; elbow,カ; ケ,うり,6,,ka (ON); ke (ON); uri (KUN)
弧,2023,arc,bow; melon; claw; vulture; elbow,コ,,9,N1,ko (ON)
孤,2024,orphan,child; melon; claw; vulture; elbow,コ,,9,N1,ko (ON)
繭,2025,cocoon,flowers; hood; stick; thread; spiderman; insect,ケン,まゆ; きぬ,18,N1,ken (ON); mayu (KUN); kinu (KUN)
益,2026,benefit,animal horns; one; floor; animal legs; eight; dish,エキ; ヤク,ま.す,10,N1,eki (ON); yaku (ON); ma.su (KUN)
暇,2027,spare time,sun; day; hobby; staples; mouth; box; crotch,カ,ひま; いとま,13,N1,ka (ON); hima (KUN); itoma (KUN)
敷,2028,spread,arrowhead; rice field; brains; compass; direction; taskmaster,フ,し.く; -し.き,15,N1,fu (ON); shi.ku (KUN); -shi.ki (KUN)
来,2029,come,not yet; animal horns,ライ; タイ,く.る; きた.る; きた.す; き.たす; き.たる; き; こ,7,N5,rai (ON); tai (ON); ku.ru (KUN); kita.ru (KUN); kita.su (KUN); ki.tasu (KUN); ki.taru (KUN); ki (KUN); ko (KUN)
気,2030,spirit,landed fish; reclining; lying down; one; floor; fishhook; sheaf,キ; ケ,いき,6,N5,ki (ON); ke (ON); iki (KUN)
汽,2031,vapor,water; water droplets; water pistol; landed fish; reclining; lying down; one; floor; fishhook,キ,,7,N1,ki (ON)
飛,2032,fly,hook; propeller; measuring box; thousand; needles,ヒ,と.ぶ; と.ばす; -と.ばす,9,N3,hi (ON); to.bu (KUN); to.basu (KUN); -to.basu (KUN)
沈,2033,sink,water; water droplets; water pistol; garter; crown; human legs,チン; ジン,しず.む; しず.める,7,N2,chin (ON); jin (ON); shizu.mu (KUN); shizu.meru (KUN)
枕,2034,pillow,tree; wood; garter; crown; human legs,チン; シン,まくら,8,,chin (ON); shin (ON); makura (KUN)
妻,2035,wife,ten; needle; rake; woman,サイ,つま,8,N3,sai (ON); tsuma (KUN)
凄,2036,nifty,ice; wife; ten; needle; rake; woman,セイ; サイ,さむ.い; すご.い; すさ.まじい,10,,sei (ON); sai (ON); samu.i (KUN); sugo.i (KUN); susa.majii (KUN)
衰,2037,decline,pathetic; stick; top hat; scarf; mouth,スイ,おとろ.える,10,N1,sui (ON); otoro.eru (KUN)
衷,2038,inmost,ten; needle; mouth; scarf,チュウ,,9,N1,chuu (ON)
面,2039,mask,hundred; one; ceiling; drop; pent in; eye,メン; ベン,おも; おもて; つら,9,N3,men (ON); ben (ON); omo (KUN); omote (KUN); tsura (KUN)
麺,2040,noodles,barley; grow up; walking legs; mask; hundred; one; ceiling; drop; pent in; eye,メン; ベン,むぎこ,16,,men (ON); ben (ON); mugiko (KUN)
革,2041,leather,flowers; car; mouth; ten; needle,カク,かわ,9,N2,kaku (ON); kawa (KUN)
靴,2042,shoes,leather; flowers; car; mouth; ten; needle; change; person; spoon; sitting on the ground,カ,くつ,13,N3,ka (ON); kutsu (KUN)
覇,2043,hegemony,old west; leather; flowers; car; mouth; ten; needle; moon; month; flesh; part of the body,ハ; ハク,はたがしら,19,N1,ha (ON); haku (ON); hatagashira (KUN)
声,2044,voice,samurai; flag; stick,セイ; ショウ,こえ; こわ-,7,N3,sei (ON); shou (ON); koe (KUN); kowa- (KUN)
眉,2045,eyebrow,flag; stick; eye,ビ; ミ,まゆ,9,N1,bi (ON); mi (ON); mayu (KUN)
呉,2046,give,mouth; chair; tool; animal legs,ゴ,く.れる; くれ,7,N1,go (ON); ku.reru (KUN); kure (KUN)
娯,2047,recreation,woman; give; mouth; chair; tool; animal legs,ゴ,,10,N1,go (ON)
誤,2048,mistake,say; words; keitai; mouth; give; mouth; chair; tool; animal legs,ゴ,あやま.る; -あやま.る,14,N3,go (ON); ayama.ru (KUN); -ayama.ru (KUN)
蒸,2049,steam,flowers; helping hand; complete; water; one; floor; oven-fire; barbecue,ジョウ; セイ,む.す; む.れる; む.らす,13,N2,jou (ON); sei (ON); mu.su (KUN); mu.reru (KUN); mu.rasu (KUN)
承,2050,acquiesce,water; complete; three,ショウ; ジョウ,うけたまわ.る; う.ける; ささ.げる; とど.める; たす.ける; こ.らす; つい.で; すく.う,8,N2,shou (ON); jou (ON); uketamawa.ru (KUN); u.keru (KUN); sasa.geru (KUN); todo.meru (KUN); tasu.keru (KUN); ko.rasu (KUN); tsui.de (KUN); suku.u (KUN)
函,2051,bin,snare; sparkler; shovel,カン,はこ; い.れる,8,,kan (ON); hako (KUN); i.reru (KUN)
極,2052,poles,decay; tree; wood; snare; mouth; crotch; one; floor,キョク; ゴク,きわ.める; きわ.まる; きわ.まり; きわ.み; き.める; -ぎ.め; き.まる,12,N2,kyoku (ON); goku (ON); kiwa.meru (KUN); kiwa.maru (KUN); kiwa.mari (KUN); kiwa.mi (KUN); ki.meru (KUN); -gi.me (KUN); ki.maru (KUN)
牙,2053,tusk,,ガ; ゲ,きば; は; きばへん,5,,ga (ON); ge (ON); kiba (KUN); ha (KUN); kibahen (KUN)
芽,2054,bud,flowers; tusk,ガ,め,8,N1,ga (ON); me (KUN)
邪,2055,wicked,tusk; city walls,ジャ,よこし.ま,8,N1,ja (ON); yokoshi.ma (KUN)
雅,2056,gracious,tusk; turkey,ガ,みや.び,13,N1,ga (ON); miya.bi (KUN)
釈,2057,interpretation,animal tracks; drop; rice; shaku-hachi; flag; stick,シャク; セキ,とく; す.てる; ゆる.す,11,N1,shaku (ON); seki (ON); toku (KUN); su.teru (KUN); yuru.su (KUN)
番,2058,turn,dice; animal tracks; drop; rice; rice field; brains,バン,つが.い,12,N3,ban (ON); tsuga.i (KUN)
審,2059,hearing,house; dice; animal tracks; drop; rice; rice field; brains,シン,つまび.らか; つぶさ.に,15,N1,shin (ON); tsumabi.raka (KUN); tsubusa.ni (KUN)
翻,2060,flip,dice; animal tracks; drop; rice; rice field; brains; feathers; wings,ホン; ハン,ひるがえ.る; ひるがえ.す,18,N1,hon (ON); han (ON); hirugae.ru (KUN); hirugae.su (KUN)
藩,2061,clan,flowers; water; water droplets; water pistol; dice; animal tracks; drop; rice; rice field; brains,ハン,,18,N1,han (ON)
毛,2062,fur,,モウ,け,4,N2,mou (ON); ke (KUN)
耗,2063,decrease,christmas tree; fur,モウ; コウ; カウ,,10,N1,mou (ON); kou (ON); kau (ON)
尾,2064,tail,flag; fur,ビ,お,7,N1,bi (ON); o (KUN)
宅,2065,home,house; lock of hair,タク,,6,N3,taku (ON)
託,2066,consign,say; words; keitai; mouth; lock of hair,タク,かこつ.ける; かこ.つ; かこ.つける,10,N1,taku (ON); kakotsu.keru (KUN); kako.tsu (KUN); kako.tsukeru (KUN)
為,2067,do,so; strange building; tail feathers,イ,ため; な.る; な.す; す.る; たり; つく.る; なり,9,N1,i (ON); tame (KUN); na.ru (KUN); na.su (KUN); su.ru (KUN); tari (KUN); tsuku.ru (KUN); nari (KUN)
偽,2068,falsehood,person; do; so; strange building; tail feathers,ギ; カ,いつわ.る; にせ; いつわ.り,11,N1,gi (ON); ka (ON); itsuwa.ru (KUN); nise (KUN); itsuwa.ri (KUN)
畏,2069,apprehensive,rice field; brains; hairpin; safety-pin,イ,おそ.れる; かしこ.まる; かしこ; かしこ.し,9,,i (ON); oso.reru (KUN); kashiko.maru (KUN); kashiko (KUN); kashiko.shi (KUN)
長,2070,long,hair; hairpin; safety-pin,チョウ,なが.い; おさ,8,N5,chou (ON); naga.i (KUN); osa (KUN)
張,2071,lengthen,bow; long,チョウ,は.る; -は.り; -ば.り,11,N1,chou (ON); ha.ru (KUN); -ha.ri (KUN); -ba.ri (KUN)
帳,2072,notebook,towel; long,チョウ,とばり,11,N1,chou (ON); tobari (KUN)
脹,2073,dilate,moon; month; flesh; part of the body; long,チョウ,は.れる; ふく.らむ; ふく.れる,12,N1,chou (ON); ha.reru (KUN); fuku.ramu (KUN); fuku.reru (KUN)
髪,2074,hair of the head,hairstyle; hair; shape; friend,ハツ,かみ,14,N3,hatsu (ON); kami (KUN)
展,2075,unfold,flag; salad; hairpin; safety-pin,テン,,10,N1,ten (ON)
喪,2076,miss,soil; dirt; ground; mouth; hairpin; safety-pin,ソウ,も,12,N1,sou (ON); mo (KUN)
巣,2077,nest,owl; fruit; rice field; brains; tree; wood,ソウ,す; す.くう,11,N1,sou (ON); su (KUN); su.kuu (KUN)
単,2078,simple,owl; rice field; brains; ten; needle,タン,ひとえ,9,N3,tan (ON); hitoe (KUN)
戦,2079,war,simple; owl; rice field; brains; ten; needle; fiesta,セン,いくさ; たたか.う; おのの.く; そよぐ; わなな.く,13,N3,sen (ON); ikusa (KUN); tataka.u (KUN); onono.ku (KUN); soyogu (KUN); wanana.ku (KUN)
禅,2080,Zen,zen; altar; simple; owl; rice field; brains; ten; needle,ゼン; セン,しずか; ゆず.る,13,N1,zen (ON); sen (ON); shizuka (KUN); yuzu.ru (KUN)
弾,2081,bullet,bow; simple; owl; rice field; brains; ten; needle,ダン; タン,ひ.く; -ひ.き; はず.む; たま; はじ.く; はじ.ける; ただ.す; はじ.きゆみ,12,N1,dan (ON); tan (ON); hi.ku (KUN); -hi.ki (KUN); hazu.mu (KUN); tama (KUN); haji.ku (KUN); haji.keru (KUN); tada.su (KUN); haji.kiyumi (KUN)
桜,2082,cherry tree,tree; wood; owl; woman,オウ; ヨウ,さくら,10,N1,ou (ON); you (ON); sakura (KUN)
獣,2083,animal,owl; rice field; brains; one; mouth; chihuahua; dog; large; drop,ジュウ,けもの; けだもの,16,N1,juu (ON); kemono (KUN); kedamono (KUN)
